hs_class,text
negative,mohon maaf hubung tes dna partai komunis indonesia ideologi pandang politik turun genetik
negative,buka twitter informasi dengar dengar benda curiga duga bom temu barel oi stay save kang wa eg enak kang cilung anak indekos amp warga barel
negative,ku khawatir tenaga kerja asing angkat senjata kuasa desa singgah markas wilayah indonesia timur langsung
negative,pakai baju abu abu duta kuwait sekretaris badan nasional lindung tenaga kerja indonesia tatang b razak diskus urus tenaga kerja indonesia
negative,orang hebat serah karir ngewe pe emanan kunci buka telinga dengar keluh kesah
negative,yahudi
negative,mintak jasa kawan kawan lini benda nih my relative nurliyana abdul razif alami hyper tiroid and it si become worse right now she really need bantu uang rawat bank in kat account nih nurliyana abdi razif 0
negative,lelucon kulit hitam transgender badan ukur mata tebal bibir agama lucu manusia alas diskriminasi subsidi silang konten
negative,iya sih emak ku bilang tertawa nya kayak kunti
negative,komisi berantas korupsi periksa gubernur sumatra utara calon wakil gubernur ijeck sah
negative,pe umbuhan ekonomi indonesia kua al i 2018
negative,ratus ulama santri desak anugerah gelar pahlawan nasional kh ahmad sanusi pikir rakyat
negative,teman gue taman mini indonesia indah teriak teriak culi pas cowok ganteng sipit sipit n2pm wkwk
negative,segeulgie cantik sipit kayak
negative,35 kreasi kreatif as koran bekas lynde sitepu rp70 000 00 buku gpu
negative,suyanto mitra surat perintah henti sidi kur bank a graha international optimis program daya 142 padi hitam amp 70 padi putih potensi panen varietas capai 9 ton gabah kering program lestari tradisi masyarakat tani jawa
negative,wkwk kadang suka bingung orang orang bikin janji iblis tanggung bikin janji kaya maslahat umat hidup manfaat orang
negative,anti asing
negative,buaya nih buaya muara buaya darat siluman buaya
negative,jokowi harap bandara ajati dongkrak ekonomi jawa barat
negative,terima kasih presiden selamat tulus moga sehat allah jokowi amin salam periode
negative,gue nge i2 ekonomi banget sih
negative,mata hati kelilip a buta cinta
negative,kawan aktivis 98 gera lembar moerdani biaya anak anak nih notabene organisasi mahasiswa bentuk partai komunis indonesia
negative,asing asing antek partai komunis indonesia yahudi kapitalis rangkap komunis
negative,alhamdulillah rapat famili perdana bani nafisah jalan khidmat
negative,politikus lawak maaf kayak karakter lawak haji bolot dengar xe2 x80 xa6
negative,cowok miss queen duit transgender biar miss queen etik sih xf0 x9f x98 xa3
negative,jatuh te impa tangga alami ramli anwar pegawai pajak kena ott peras korban rupiah 50 juta ramli pecat via
negative,bu loyal hadap jokowi wakil presiden beliau suka ikan suka uang mata duit
negative,body lufra scrub bahan dasar lidah buaya melembabkan kulit amp cahaya info 087812026394 body mass index
negative,ronaldo pardede siswa katolik santo petrus kelas 1a 2b 3c 1984 1987
negative,bidik nista ulama
negative,sabar hina allah rasul nya ibnu maktum tegur wanita yahudi kali indah wanita yahudi paksa beliau nyata mati perkara lapor bag
negative,aduh lebay nya didik soeha o bob hasan menteri kabinet bangun jabat 3 16 maret 1998 xe2 x80 x93 21 mei 1998 bob hasan aka muhammad h
negative,kamar glusar glusur buaya kasur xf0 x9f x98 x81 xf0 x9f x98 x81
negative,dasar ayat al alquran allah hilang ilmu kelip mata hilang ilmu ranah hilang ulama muka bumi lantik ketua manusia jahil
negative,1 kaya asing deh lupa
negative,debat istilah islam nusantara tuding pro khilafah hati isis dukung islam nusantara cap antek antek jil pro yahudi bid ah sesat ya deklarasi orang indonesia be
negative,cebong
negative,urus pilih pimpin urus mustahil 20 ayat al qur an perintah umat islam pilih pimpin kriteria khusus umat mesti sadar posisi pimpin pilih agama bangsa
negative,chirpified presiden ubah izin integrasi pusat daerah
negative,hibah tawar program diploma didik lepas ijazah dpli program ijazah sarjana muda didik didik islam ismppi masuk september 2018 unisza sukacita maklum universitas sultan zainal
negative,senin udik tani acara tarik juri asyik asyik suara kontestan autentik tampil fantastis grab takes you there idol spektakuler top 3 idol by opera
negative,presiden paksa terap online single submission news jambi
negative,haha sipit melek
negative,tau autis
negative,deh seru banget beku memori hem halo lihat sih nia tengok nihil tanam hantu ya kunti
negative,xe2 x9d x80 xe3 x80 x80sebuah nama asing dengar anna pikir sang dara hadap huni habis kenal tampil maaf perrault san nama anna kobayakawa mathilda san anna
negative,asalamualaikum alaykum selamat pagi sobat suara ganti rezim ganti presiden pilih kepala daerah 27juni 2018 amp pilih presiden 2019 pilih pasang calon usung ai idealis berma abat keramas sumatra utara mbangun jateng mukti bareng j
negative,fiksi fakta
negative,burung twitter burung onta mantap suara remaja choice fandom directioners
negative,haru baca twit carpoolge14 pulang undi jantina bangsa agama selamat malaysia moga jalan pergi selamat god bless
negative,asing asing musim kali bang musim musim plesiran
negative,jodoh presiden pengantin wanita tajikistan sedih
negative,bang presiden
negative,aaaa koordinator wilayah dewan pimpin cabang pondok cina nih smash blast bis maniak smash is back
negative,orang ahli kitab yahudi nasrani salam balas wa xe2 x80 x99alaikum xe2 x80 x9d bukhari muslim
negative,tabah pasang taufik puan nurliyana wajar contoh jom sumbang ringan beban pasang come on twitter do your pikir badan standar nasional 0510541000096745 bank islam 05058020145124 nurliyana bosan abdul razif
negative,agama milik kitab suci milik kitab suci ya cuek bro
negative,habis lempar batu sembunyi tangan habis pasang bom sembunyi sembunyi
negative,lae komen adminnya ai studi tau ekonomi makro ya negara gampang cetak uang nilai mata uang turun mata uang laku sepe i komoditi diperjualbelikan
negative,kayak autis lucu an inti deh
negative,barel duga bom
negative,cinta buta
negative,tai gue
negative,coba helikopter pakai united kingdom serang yahudi zionis ya
negative,presiden jokowi apresiasi model kerja bisnis proyek bandara internasional jawa barat ajati
negative,eksorsisme usir setan agama katolik kristen
negative,presiden jokowi ikan gamelan sekolah presiden joko widodo gamelan
negative,komunis main
negative,status kafir relatif gantung tinjau sudut santai
negative,ya narasi keras bom sensitif situasi bera i pikir mem
negative,kemarin enak laku anies sandi 7 kuasa daerah khusus ibukota dengar
negative,sang maestro sang calon presiden calon wakil presiden ri 1 nih pintar pro orang otoriter
negative,belagu imam
negative,hati orang model kayak akal sehat beda orang gila akal waras normal hina iman orang hina
negative,deklarasi pilih kepala daerah 2018 aman anti hoaks warga kedungcangkring jabon
negative,info sesat paspor 24 paspor tenaga kerja indonesia khusus tenaga kerja indonesia iya 2010 2010 paspor 24 paspor pepo bahas pin
negative,rakyat butuh pangan sedia beton be ulang
negative,suka iri orang orang rahasia kulit mulus air wudhu kristen
negative,salat aji allah khayal pacar kayak aktor korea ya ampun sih situ tonton pikir tolong stop kait agama
negative,a selera suka kejut
negative,coco lee kayak mata sipit kulit tanned sih tata young blaster amerika deh kayak
negative,semangat amp istikamah
negative,efek asing
negative,adam hawa kali hawa hawa lesbi
negative,takut sih gebuk anti asing
negative,kasar komunis free sex cadang minyak limpah mudah capai had
negative,beli barang kirim cina paket transit cinta indonesia 3 minggu xf0 x9f x98 xa2
negative,bincang presiden
negative,ganti presiden 2019 jokowi
negative,ya iya minion main md1 duo daddy md2 md1 fajar ardianto md3 md2
negative,tuyul kali ah usir guanlin xf0 x9f x99 x84
negative,katekismus gereja katolik larang minum keras lantang budak minum keras ayat nyata anggur positif khotbah mazmur amos sepe i minum anggur hati senang
negative,nyata fadli zon potensi korupsi pilih kepala daerah dewan wakil rakyat daerah
negative,obat monyet kedih uniform resource locator
negative,ceruk pasar pasar pasar butuh contoh asuransi pensiun tentara us orang pensiun tentara pensiun tentara asuransi alat butuh orang cacat orang cacat ta
negative,program 18 lindung sepenuh produk waris budaya ekspresi budaya tradisional hak cipta seniman asyik menang asyik menang
negative,bom atom
negative,suka laku idiot bareng oppa xf0 x9f x92 x83 xf0 x9f x98 x82 uniform resource locator
negative,umat hindu selamat ulang presiden soeha o
negative,gubernur goda tau kuat nu hang
negative,fadli zoom politik sih politik negara republik indonesia sejarah lupa pribadi ainya sadar biar kaco negara yuk bela bantu presiden jokowi makmur
negative,sampah ambil kursi cafe manjaaaaa ketulungan
negative,politik sadis kejam suka ancam xf0 x9f x98 x86 xf0 x9f x98 x86 xf0 x9f x98 x86
negative,contoh nya daerah khusus ibukota impor bawang cina gubernur nya kroni sih tengku
negative,sedia lapang kerja 24 000 orang indonesia karyawan persero batas freeport indonesia 69 75 karyawan nasional 28 05 karyawan papua a 2 2 karyawan asing freepo 51
negative,hati hati syiah musuh sahabat fakta lihat kondisi suriah lihat hubung rusia komunis cina
negative,haha hayo ya racist cina cina nenek moyang cina selatan nama cina xe2 x9c x8c xe2 x9c x8c
negative,suka joged bumbung eka satya budaya kuwum marga tolak berita hoaks dukung pilih kepala daerah damai
negative,negara dunia cengkeram komunis asia tenggara negara jatuh tangan komunis
negative,jokowi pilih 2019 calon presiden bongkar pasang isi lobang congklak presiden coba coba pikir lurus amp negeri urus pilih 2019 jokowi 2019 jokowi jokowi kuat
negative,sih fair soeha o soekarno sala dengar orang puja soekarno dengar partai komunis indonesia soeha o dengar golkar
negative,heboh anies be emu erdogan warganet gubernur presiden plonga plongo obrol sambung plonga plongo pimpin muslim ya komen warganet
negative,cari sumber berita bantu kasih link website resmi bangun bandara rencana groundbreaking 2016 jokowi
negative,iya eh kuping kayak asing wkwk
negative,guncang dengar ulama zaman usaha hindar orang orang sepe i hati tang allah takut perosok ideologi
negative,tim sukses pasang calon pilih gubernur jawa timur 2018 apresiasi debat kandidat
negative,gue culun orang bekal mimpi minat amp ketrampilan
negative,ketua dewan wakil rakyat dorong inspirasi kreatif perintah sesuai budaya pancasila
negative,kain kafan pakai muslim bungkus mayat tradisi adat budaya yahudi yohanes 19 40 ambil mayat yesus kafan kain lenan bubuh rempah rempah
negative,tanah abang trotoar sampah
negative,nya sok munafik sih larang agama ku agama baca ajar xf0 x9f x99 x8f maaf ya dosa dosa laku
negative,bodoh goblok
negative,sahabat budidaya prof penuh skala ekonomi teknologi state of the a supply chain manajemen sistem integrasi sustainable development principles maju akuakultur
negative,potensi lokasi ajar daerah toreh sabrang kidul purwosari girimulyo cocok be anam salak dongkrak ekonomi
negative,budek deact kayak akun jinkiw bijak akun masuk mantap gue
negative,kualitas bayar 31 mar gratis mending pakai antena tonton indon ar xf0 x9f x98 xa3 uniform resource locator
negative,sembak camp jual susu sapi murni susu sapi orang kambing orang kuda orang onta orang zebra murni tutup hidung pas minum he
negative,8 anak anak aktivis jabat palestina rencana usir warga palestina area luas mukim ilegal yahudi kefar adumim yerusalem tepi barat
negative,bisu bisu kalbu sepe i doa doa harap moga
negative,desa udik definisi universal buah aglomerasi mukim area desa rural indonesia
negative,tomohon rupa pusat ajar agama kristen katolik khusus doa meditasi bukit kasih buah suci indah tenang tomohon international flower festival chapter
negative,4 alami kendala atur chat
negative,selamat kakak kali raya makna kali
negative,xf0 x9f x98 x81 xf0 x9f x98 x81 xf0 x9f x98 x81 jabat perintah gubernur tingkat menteri dewan wakil rakyat layak potong gaji bayar pajak bayar zakat mal sisa fakir miskin tutup utang tawar
negative,rumah ranah indah orang diam culun bakar
negative,amanah abdi tingkat budaya kerja birokrasi selamat kerja selamat karya
negative,orang orang tuding antek asing asing sungguh be epuk tangan
negative,khofifah nawa bakti satya debat malam
negative,menge i baca selesai ambil hikmah pikir positif rational juang moral jokowi wakil presiden jusuf kalla sambut acara simposium ekonomi
negative,syiah yahudi
negative,gara gara orang kafir yahudi coba pakai handphone sih aduh carrefour ubah nama indomaret
negative,mata sipit marah senang lirik segar haha enak nya sih mata sipit
negative,sambung kuliah maghrib khas syekh kurayyim rajih ketua ulama alquran suriah ustaz nazmi smackdown terjemah rasmi beliau lokasi masjid al muttaqin wangsa lawat
negative,percaya dukung beliau aktivis tulen abal abal kiprah ai beliau kenal konsisten juang orang cilik penjara zaman huta
negative,partai komunis indonesia bangkit
negative,habis kesal tegur efek rokok salah bikin budek sih rokok ya kak ajus xf0 x9f x99 x88
negative,sila simak gubernur indonesia be emu presiden salat jum at
negative,orang jaman tau pisang obat pusing xe2 x80 x93 monyet pusing
negative,gue lipat lipat nogt pimpin sayang ya nih pergi onta
negative,hadis rasulullah beli makan orang yahudi hutang tunda gadai perisai nya
negative,2009 df ajak sutiyoso gabung low back pain abdullah makhmud hendropriyono kawan kawan jokowi presiden ri df donatur utama citra jokowi 2010 2014 susilo bambang yudhoyono koalisi low back pain abdullah makhmud hendropriyono kawan kawan angkat df menteri rumah oktober 2011 mudah
negative,terkadang paksa senyum hati senyum munafik lihat
negative,kali lihat tellernya urus mata uang asing tau omong coba satpam ambil nomor antre suka satpam ambil nomor
negative,alam budaya indonesia sungguh atraktif indah destinasi malaysia banding indonesia turis asing indonesia kalah malaysia
negative,agama kartu tanda duduk te ulis agama islam hindu percaya nusantara kristen
negative,amerika negara maju contoh demokrasi presiden rasialis pilih
negative,orang paham bicara gue fangirl antek antek
negative,rute pondok cina gang sentiong berangkat pe sedia 04 28 indonesia barat tks 2
negative,om dengar salah nikah ya warga negara asing nkl mia audina warga negara belanda salah
negative,bank rumah realisasi
negative,kak ajar bicara orang asing khusus extrove outgoing puhliiiis hehe xf0 x9f x98 x81 xf0 x9f x98 x81 xf0 x9f x98 x81
negative,pilih tenaga kerja indonesia non prosedural ilegal cari untung risiko gede banget tugas imigrasi paspor kedok lancong jalan jalan 100 tuju
negative,foto foto loba tari sekolah dasar lks lomba terampil siswa sekolah juru janji adat gorontalo gadis anjak remaja 2010 ccu cross cultural understanding universitas k
negative,nomor 7 anak hilang tangan amp kaki injak ranjau sih anak kasih tau kabar buruk orang tua kondisi orang tua terima orang cacat beban sakit hati dengar
negative,seulgi bilang mata barat kelopak mata timur gaya banget sipit seulgi pikir poin tarik
negative,as serang suriah dukung israel turki arab saudi warga palestina jalur gaza laku aksi demo bakar bendera as amp dukung presiden suriah bashar al assad pe anyaanya suka demo bawa bendera palestina kem
negative,bunuh sakit ledak bom nuklir mahal sih
negative,katolik kristen reformis protestan giat giat oikumene rangka kristus hierarki persis zaman r
negative,syarat tai chi tau main lawan tau materi lawan pintar selesai buku cerdas tangkas jilid 5b uniform resource locator
negative,pantat sapi
negative,mendung untung sari hati
negative,halo masuk inggris baris tugas aman sepe i efektif cegah gesek super er tugas aman fokus pandang arah super er bikin rusuh langsung ciduk
negative,uang jajan pakai potong bensin anter jemput sekolah pekan bela in xe2 x80 xa6
negative,reklamasi jaka a atur revisi atur presiden jakarta bogor depok tangerang bekas puncak cianjur
negative,tiada paksa islam kafir mu monggo budaya lokal tuju islam sempurna proses islam hormat
negative,tante kunti juta lumayan lebaran nih xf0 x9f x98 xa5
negative,lupa ayah mati bom bunuh susilo bambang yudhoyono linglung
negative,alhamdulillah presiden kasih contoh k kerja keras kenal lelah keluh optimis bangun negeri love presiden
negative,orang nasrani orang yahudi orang majusi orang islam lampau gagas sempit salah be emu xe2 x80 x9csuatu ruang murni xe2 x80 x
negative,johor negeri pesat bangun golong profesional jaga agama
negative,zaman wali sanga zaman zaman wali sanga nusantara isi nya hindu buddha ateis anti ajar islam unsur islam masyarakat zaman xc2 xb2nya nikah adat k
negative,nafi fakta dakwah ajak orang rang orang era bom bal kemarin surabaya
negative,lihat onta nama langsung serbu wisata wisata gratis hhhh
negative,undang undang md3 buru buru sahkan undang undang dasar md 3 ganti
negative,ketua komisi pemelihan nilai debat pilih gubernur jawa timur langsung tarik
negative,aji salat budaya arab saudi muhammad kuasa jazirah arab
negative,ya serah balas fokus kerja kerja tugas proyek seni budaya 2 langsung kumpul presentasi syukur nilai muas proyek
negative,sih kriminalisasi lawan ide
negative,sih jam jam malam laperrrr tau badan almarhum habis kali gue oceh badan gembrot hmmmmmmmmmm
negative,cek kesiap kam pilih kepala daerah nyata polisi resor samarinda milik mobil patroli samapta bhayangkara
negative,pakar ekonomi sambut positif jokowi harry tanoe
negative,bawang putih komunis makan
negative,mainstream oposisi kesan negeri ndr horor utang miskin nge fan puti xe2 x80 xa6
negative,12 presiden harap skema kerja laku bangun bangun
negative,moga istikamah xf0 x9f x91 x8d nikita mirzani orang saleh malam kafir pagi istikamah juang hidayah allah rahasia makhluk hak
negative,morgan agama yahudi kristen islam suku maya hindu buddha cari kiamat the story of god
negative,keluarga belo ku sipit xf0 x9f x98 x82
negative,nalar sehat pikir buruk puisi tulis orang ulama cinta islam orang ulama rindu islam tumbuh ajar kasih sayang rahmat masyarakat negeri percaya
negative,cek yuk komisi berantas korupsi periksa gubernur sumatra utara calon wakil gubernur ijeck sah komisi berantas korupsi periksa gubernur sumatra
negative,visi misi islam nusantara visi misi partai komunis indonesia poles lihat cantik
negative,assalamualaikum bu risma tolong warga jalan kalimas udik 1c rumah jalan kalimas udik 1b 1 bantu bu risma warga rumah roboh kasihan bu risma warga tinggal rumah roboh
negative,main liga inggris regulasi batas main asing aduh
negative,2 jamu last super kristen salah murid yesus khianat yudas rupa orang 13 duduk kursi yesus salib jumat konon jumat hawa goda adam buah larang
negative,nista nder hidup iya sayur garam hambar wkwk
negative,lupa twitter instagram foto komen ih cantik cantik xe2 x80 xa6
negative,tim seniman pimpin coba konsep jaket wakil ragam budaya indonesia gambar peta indonesia nuansa merah putih makna negara indonesia pilih
negative,asam folat ganggu bentuk otak cacat bawa susun saraf pusat otak janin
negative,oh ya lupa terima kasih presiden jalan negara jamah aspal mulus pos lintas batas malu malu serasa surga
negative,cecilia mama muda canolly islam lihat bukti bukti kuasa allah
negative,adopsi cerdas potensi ekonomi digital capai 23 triliun dolar as
negative,kejang kejang ya bong keren dewasa malu malu
negative,status gue ateis umat agama relevan situasi kondisi identitas beda nyata output pikir
negative,kerja bangun negeri
negative,cultural amp critical studies alhamdulillah lulus ku lepas derita
negative,jelang pilih kepala daerah perhati gubernur kalimantan
negative,keren wa eg pakai taplak meja
negative,3 presiden gelar 171 pilih kepala daerah pilih kepala daerah serentak pilih kepala daerah gubernur bupati wali kota jokowi ajak ulama sejuk pilih kepala daerah
negative,biografi calon ketua dema universitas islam negeri syarif hidayatullah jaka a no urut 3
negative,berita gubernur banten eksplorasi panas bumi batu kuwung jalan terbit panas bumi news
negative,agama cacat hawa nafsu asy shihab
negative,bahasa dengar tuli lihat buta
negative,lokasi klenteng jalan panjaitan imlek klenteng mempe unjuk tari tradisional tionghoa kunjung ayo festival pesona bunaken
negative,ai dukung ppp gelar musyawarah nasional ulama cari calon wakil presiden jokowi
negative,umat islam ri sikap tindak kalah proxy asing menang perang asimetri konspirasi global cukong by chirpstory
negative,orang cacat laksana gunung batu
negative,gue bicara kasar goblok doang
negative,ya fan nya mino jatuh mino perek antek antek nya nih lost the receipts but still baca nya putus diam
negative,eks zaman rejim najib xe2 x9c x8c
negative,anies super gubernur isi kuliah maroko banget kandang markas komando anies top
negative,bioskop duduk 2 bocah poni lempar tegur ancam tengkar panggil secure xe2 x80 xa6
negative,dukung prabowo ragu elektabilitasnya anjlok prabowo kali maju gagal rakyat bosan calon fresh peluang menang
negative,lidah buaya lidah me ua gelombang cinta nya tanam hias sarana curhat favorit botanist terubus mania
negative,buku lawas ilmu agama muhammad hatta 1983 36 halaman harga 125 000 minat
negative,pagi bogor dagang kaos ganti presiden sayang t arik dagang ramai sepi sih dagang beres dagang amp pulang beres beres ramai ramai unjung masyarakat waras amp ce
negative,urus duit hitung bisnis perintah indonesia untung ya tepuk tangan buntung ya risiko rezim model harga janji harga wajar wajar
negative,bibit lgbt tumbuh uniform resource locator
negative,orang anak pekan ilham dasar ekonomi deb gerak utama maju ekonomi bandar beliau allah ya rahman tun abdul razak ds malaysia pilih hogohundi
negative,jawa timur anti hoaks pilih kepala daerah damai deklarasi anti hoaks warga kemlaten
negative,gubernur jaman now ya anti hoaks sebar isu ganjar yasin menang ganjar yasin 1 ganjar yasin
negative,sumbu pendek lelah
negative,momen giat budaya rencana ribu warga badui banjir kota serang exciting banten seba baduy generasi pesona indonesia cilegon
negative,masuk umat orang hormat orang tua sayang anak anak mulia alim ulama ahmad thabrani hakim
negative,islam damai tentram negara negara komunis
negative,kafir
negative,oke mas tuduh raden mas arya berat bela kasar sejarah konflik arab dalang us
negative,bom wtc minyak irak kabar
negative,sipit cantik xf0 x9f x98 x86
negative,taplak gunung teplak gunung
negative,suka agama politik salah suka makan babi minum minum keras pilih pimpin nasrani yahudi pimpin surat perintah henti sidi bukti zina nya tinggal zina 7 bukti
negative,eng ing eng komisi berantas korupsi periksa gubernur calon wakil gubernur sumatra utara ijeck sah
negative,ubah total anti asing asing cinta asing asing
negative,barangkali sepe i sudut pandang mudah awat cagar budaya rg masyarakat adat hibah perintah daerah masyarakat adat hilang milik salah dasar bakau negara
negative,orang jail nak islam salat islam nih didik layan khusus islam angkat ganja salat badan tato minum club tunggu masuk prison nak ubah
negative,menung film si cario malam yahudi
negative,doa bangsa ajar islam partai adil sejahtera ai dakwah genah ya allah engkau jokowi ilah beliau bawa bangsa maju engkau
negative,nyata he he insiden helikopter jatuh nyata pt indonesia morowali industrial park kerja 3000 warga negara asing cina
negative,nayeon bolot xf0 x9f x98 xa0
negative,anak cucu anut agama yahudi nasrani
negative,sumber daya manusia kuat daya saing aspek dukung tingkat bangun bidang ekonomi bidang sosial budaya
negative,well agama ateis rugi sisi cewek utama hitung uang hangus sita tenaga air mata keringat darah korban
negative,orang salah terima buruk orang
negative,baca mas beli islam hindu beliau xe2 x80 x9ctdk nilai islam kacamata hindu xe2 x80 x9d beliau menja
negative,ajak terjun langsung hidup nyata masyarakat latih peka sosial budaya ekonomi politik tingkat indeks prestasi kumulatif indeks kembang kolektif terap melulu prestasi kumulatif theoretical
negative,untung untung komunis ateis
negative,jual amik untung teruk kali ganda charge goods and services tax yahudi
negative,gue katolik asa negeri katolik kristen buddha hindu islam haha
negative,deny muslim kristen ya
negative,sisi sadar gender tetangga belah maju kerja istri suami urus anak ekonomi lumayan mobil 3 motor ninja 1 lingkung
negative,andritany ismed sofyan ramdani lestaluhu wakil tim persija rumah duka almarhum fahreza siang
negative,dinding kamar saksi bisu
negative,100 orang indonesia waras sehat jasmani rohani percaya presiden jokowi muslim pengaruh dunia kecuali kader anggota gerindra percaya 2019 jokowi
negative,indonesia peringkat 2 global muslim travel indeks gmti 2018 11 april 2018 menteri pariwisata damping ketua tim cepat wisata halal riyanto sofyan asisten deputi budaya oneng setyorini hadir
negative,langsung paten oh buku komunis oh buku ekstrem baca ajar buku larang manfaat ajar sejarah indonesia
negative,peran cacat
negative,semangat kantor staf presiden publikasi giat presiden rakyat tau presiden kerja keras bangun bangsa kerja kerja kerja
negative,guru fakultas ilmu sosial politik fakultas ilmu sosial ilmu politik universitas padjadjaran profesor obsatar sinaga pandang hadap program usung pasang calon gubernur wakil gubernur jawa barat nomor urut 2 hasanah hasanah hasanah
negative,masak citra tenaga kerja indonesia sepe i diaspora dahsyat dahsyat lo
negative,sadar bera i keliling tenaga kerja asing ya diam diam serang lemah lawan kerja ambil diam
negative,pancasila indonesia taat undang undang indonesia sesuai putus presiden no 6 2000 surat putus menteri agama nomor 12 2006 agama negara republik indonesia islam kristen protestan katolik hindu buddha kong hu cu agama
negative,papar kepala polisi resor bikin kepala polisi daerah pulau riau pilih kepala daerah tanjung pinang aman netral
negative,kakak sayang sekolah sekolah katolik 5 agama minggu acara agama kak good luck kak xf0 x9f x92 x9c
negative,topeng monyet ramayana nya nya nya nya uniform resource locator
negative,asa anak tinggal bom
