hs_class,text
positive,nakal nakal ya besok pakai wkwk sarap
positive,biadab kerja cina buang bendera indonesia tanah asing asing tiongkok uniform resource locator
positive,calon calon marah bos langsung resign cupu
positive,transgender anjing uniform resource locator
positive,media sampah berframing tim anies sandi kaget indra piliang tangkap kait narkoba uniform resource locator
positive,lihat banget bego nya empok silvy and agus debat final pilih kepala daerah jakarta
positive,segar rakyat janji jokowi beli pt indosat jual megawati presiden jual badan usaha milik negara
positive,sinyal cacat hilang hilang melulu hem haha
positive,rezim jokowi lengser adil kuasa jalan lengser jokowi
positive,lestari dungu biadab islam lestari dukung hadap teroris islam
positive,cebong sampah masyarakat
positive,pilih cebong huni dunia gaib ustaz komen jorok
positive,tai ajak
positive,diam kampang sakit kepala
positive,kulit sensitif nih pantang sikit je monyet
positive,jual forum konservasi leuser ngamprah haha bani kampret logika kacau
positive,antek komunis yayasan lembaga bantu hukum indonesia main main korban
positive,ganyang partai komunis indonesia kuat tenaga
positive,cisol modar
positive,anjing jahanam berisik cocot
positive,keren nama gubernur indonesia presiden karang bilang presiden indonesia presiden cebong bilang wkwk
positive,ciduk nih kunyuk proses hukum pakai matre uniform resource locator
positive,ya lucas racun cakap nya racun sarap nya nmon maaf gue racun sarap nya
positive,cewek jago ngentot berondong cakap bikin tante nafsu cari berondong uniform resource locator
positive,kristen lesbi ya
positive,sumpah ya suka orang norak berisik sewa studio tau udik ngewe
positive,cc nafsu tenaga uniform resource locator
positive,hehe kampang fandom
positive,dasar kecoa goblok ambil uang simpan bank kelola bank izin tabung bilang maling
positive,debat final pilih kepala daerah jakarta mati ahok
positive,tuju sih kunyuk pakai foto amp nama gue what the fuck
positive,ngewe yu
positive,bego
positive,alas fitnah serang presiden isu negeri kait bodoh fasik struktur goblok uniform resource locator
positive,sinting gue asli anak winner twitter
positive,indah cocot
positive,wisma darul aman kerja xc2 xb2 banci politik xf0 x9f x98 x82
positive,ky fungsi makan gaji buta habis anggar belanja negara hakim nakal rajalela bubar uniform resource locator
positive,cewek x cowok kapel panggil daddy baby terima ya cowok x cowok pakai daddy baby an jijik bangsat
positive,usir buddha myanmar bumi indonesia uniform resource locator
positive,kunyuk nih orang kasih kendor nih ciduk
positive,sekte kampret kecoa jamban 212 geng daster jokowi 2 periode pikir gue tilap duit negara andal umat xf0 x9f x98 x82
positive,c a mantan mantan gue kesal girls pilih terima doang terima busuk bejat berengsek bareng bareng
positive,sih ahok nobat babi keprek
positive,maksud gue otak manusia kampret kampung beda lo ya kampung kampung kampung guyub pandang agama raya suka bantu
positive,foto memek nya
positive,gampang banget edan
positive,jaka a era anies sandi anggur
positive,warga moskow demo turun jokowi negara nya save ustaz alfian
positive,pilih cebong
positive,akun kecebong kelola etnis te entu gaya kecut cebong jaka a dendam anies sandi
positive,diktator jokowi jongos organisasi jagal manusia nahdlatul ulama ulama
positive,usir cina 1 kota turun turun anak anak siloam usir usir injak injak
positive,homo sial bajing goblok gian amput anjing tepi jalan moga terima balas nya
positive,xf0 x9f x98 x82 xf0 x9f x98 x82 xf0 x9f x98 x82 kemarin bahak lihat bodoh km panas bilang orang ulang dungu cebong xf0 x9f x98 x82 xf0 x9f x98 x82 xf0 x9f x98 x82 xf0 x
positive,orang kasih coba hubung orang berengsek xf0 x9f x98 x82
positive,spoiler bangsat
positive,ahok nista agama olok olok surat al almaidah 51 cc
positive,indonesia beijing usir cina
positive,prabowo subianto gagal maju uniform resource locator
positive,myanmar kafir buddha teroris
positive,korupsi e kartu tanda duduk jaman susilo bambang yudhoyono tengku uniform resource locator
positive,susilo bambang yudhoyono presiden gemuk ya restoran 8 juta ya jaman jokowi 800
positive,kafir
positive,eh kasar kampang
positive,indeks demokrasi turun indeks komunis partai komunis indonesia otoritarianisme
positive,cc jago utang ribu triliun main
positive,otak toilet otak babi terima ahok kafir ahok kafir hina anggap islam sampah
positive,bodoh eh hahahhahahhhhahahaha badu arhhh ya pangan ketu ku temu cringe sial
positive,berisik duo manusia homo
positive,najis
positive,anjir sedih
positive,kayak orang bego bro b ego
positive,iman allah subhanahu wa taala dungu biadab dungu biadab bangsa
positive,keparat orang mantan gue
positive,ajar sih garong kafir
positive,retweet kontol jari sasar xf0 x9f x92 xa6 ngentot kontol sange berat bokep asia video mesum video bokep gratis xe2 x80 xa6
positive,kualitas ustad kayak goblok banget makan micin nih jokowi singkat joko widodo xe2 x80 xa6
positive,saracen narkoba jaka a pimpin anies uniform resource locator
positive,bobrok birokrasi anies sandi jabat uniform resource locator via
positive,idiot banget sih bang luk uniform resource locator
positive,anjir gue bencong
positive,lihat banget bego nya empok silvy and agus debat final pilih kepala daerah jakarta
positive,rezim anti islam tumbang 2019
positive,ruhut prabowo strok fadli zon ruhut gila indonesia lawyers club prabowo serang
positive,avatarnya sarap main ojek
positive,foto kilas ngentot kandung gue malam sengaja gue kasih kilas lihat respon 100 retweet gue xe2 x80 xa6
positive,bubar dewan wakil rakyat diam uniform resource locator
positive,anies menang tahap lengser jokowi
positive,tante vero kejo 7 hoaks kampret ya
positive,haha babi ayat pandai otak
positive,goblok ilmu pelihara otak usang din
positive,bicara ahmad dhani monyet babi anjing
positive,hajar bela nomor koruptor cuihhhhhh uniform resource locator
positive,ha bangkai nih truk
positive,yaelah chat urus lihat mesum anggota dewan wakil rakyat diam nyata selingkuh tujuh pura pura budek cebong iq ratus otak
positive,muhammad alquran manusia bejat
positive,tokoh gus dur presiden warga cina warga negara indonesia nya indonesia mw kuasa cina
positive,pagi gays coli pagi kontol coli gay bahan coli uniform resource locator
positive,kivlan zen oceh siang transfer uang prabowo dramatis indonesia lawyers club isu partai komunis indonesia masyarakat cuat
positive,pakcoy ih nya pacar kuuu
positive,nama congor oposisi isi mulut nya negatif perintah kuasa
positive,politis gerindra jokowi omong uniform resource locator presiden omong kr bisu
positive,layan 2 kontol security meeting room for the video uniform resource locator
positive,sih bani taplak kalimantan barat terima kalah cundang perang ya nih calon gubernur porno dukung
positive,iblis jahanam ci baca puisi
positive,setan nama allah subhanahu wa taala
positive,gentle mundur jabat ai ksatria
positive,iya aman mayoritas rakyat umat islam hati sakit sukses kendali sukses jaga emosi bangsa presiden pelihara cebong
positive,biar edan lil xf0 x9f x98 x82 xf0 x9f x98 x82 xf0 x9f x98 x82 xf0 x9f x98 x82
positive,pandai jilat pantat kuasa pandai tantang orang dasar lacur politik
positive,harap coblos jokowi ubah ahmadiyah bebas aktivitas ibadah nyata
positive,ahok sih kutil babi rumah lembang jaka a banjir bud
positive,gaul ya bro gaul ya wkwk 7 khianat coy sakit telor kencing onta tai babi suka suka bro iq200 kolam bro haha
positive,eh serius muntah tai hyung
positive,ngentot yu rl nya gampang sange
positive,ayat ayat dingajikan rampas halal rang bunuh penggal kafir cocok cocok penis rusak bangsa
positive,sontoloyo cebong mendem
positive,gerindra rusuh prabowo utang bayar karyawan
positive,tuduh majelis ulama indonesia oplos mudah ban islam oplos bahaya dewan wakil rakyat proses hukum urus gera fajar nusantara
positive,myanmar mayoritas islam tindas bunuh muslim jihad jihad a
positive,banci anjr wkwk uniform resource locator
positive,kerja musuh dakwah islam bubar hati rakyat hak lengser jokowi kodok tukang citra
positive,percaya cina heran jabat indonesia jongos cina kristen tegak hukum islam usir cina
positive,nama pancing konflik horizontal polisi biar lengser jokowi indonesia hancur
positive,hasil kotak kota benci jaman susilo bambang yudhoyono
positive,kontol kirim
positive,sih tolol tau perintah rezim komunis bobrok koruptor pimpin sidang dewan wakil rakyat paya cebong uniform resource locator
positive,langsung tag ainya berani ya bera i banci
positive,adab tuju adab buang islam buang islam biadab rang
positive,oke point cebong dungu intelligence quotient kolam eyel ujung ujung kolam pokok ganti ya xf0 x9f x98 x82
positive,harap partai adil sejahtera bubar partai komunis indonesia partai demokrasi indonesia juang bubar
positive,bilang citra laku citra kayak prabowo
positive,agama kristen mati abad pe engah sapu bankir rentenir yahudi pendeta tuhan
positive,rakyat dukung komisi berantas korupsi ri usut tuntas anies sandi anggota dewan wakil rakyat amien rais kuasa elite politik libat korupsi
positive,juluk anies sandi gubernur wakil gubernur saracen uniform resource locator
positive,sinis setan eon he he
positive,orang orang njeplak buka mulut publik sakau bin sarap gara gara narkoba
positive,dukung 2 periode orang ya 2019 ganti presiden solo 2019 jokowi ganti
positive,ganyang partai komunis indonesia tentara nasional indonesia uniform resource locator
positive,ambil sapu lidi biar bubar panitia khusus komisi berantas korupsi
positive,nyinyir bani kampret
positive,komisi aparatur sipil negara berani lawan iya rakyat salut ky ombudsman koar koar diam hasil urus tenaga kerja asing sulut tanah abang tutup bungkam takut organisasi masyarakat takut tuju anggar belanja daerah niat usut b
positive,bang hancur bang musnah cina babi bumi pe iwi indonesia kedok reklamasi ahok
positive,titit titit tamasya tai ah xf0 x9f x98 x82
positive,nih gerindra bikin jebak batman prabowo suruh tonton bareng film gera 30 september
positive,hai ahok pikir kayak wan abut cetek pikir merek islam otak kafir
positive,haha pepatah laden orang dungu debat gue amin deh
positive,iya cocot
positive,wkwk anjing uniform resource locator
positive,berengsek orang bikin gue kasar mulu
positive,sayang bangsa jago dukung ahok dukung mas anies suci
positive,eh dongok nama tackle injured debut 20 17 main nya kasar cidera wkwk heran otak
positive,tolol anjing
positive,bau bangkai
positive,binaraga ambon kocok kontol sembur pejuh uniform resource locator
positive,baca nete
positive,bilang otak gue belatung sarang ah eh banci isi otak hati isi belatung bangkai benci akut xf0 x9f xa4 xae xf0 x9f xa4 xae xf0 x9f xa4 xae xf0 x9f xa4 xae
positive,woi kecoa baca dungu ya dasar kecoa xf0 x9f x98 x85
positive,ngakakkk banget kepick ya derita nice mochi gue lo taken lo cacat
positive,rupiah haneul sok mes cupu entot on retweet
positive,bachtiar mabuk pipis onta
positive,memek lonte sodok kontol gede
positive,tau bego ajar maki goblok goblok
positive,ya gue balas sakit jiwa ettt laki banci uniform resource locator
positive,plakat isi kerja polisi indonesia polisi tionghoa polisi tolak markas lihat foto kayak selamat
positive,wkwk mampus pepet uji ah
positive,iya indonesia hebat indonesia banjir tenaga kerja asing jokowi keren deh top banget presiden umur hidup ayo dukung jokowi solo 2019 ganti presiden
positive,expo dul sebar ahok hongkong sapa tau ahok gubernur hongkong haha uniform resource locator
positive,kafir tulen pilih fuck
positive,menteri capai target ganti presiden janji lengser
positive,mantap mahmud kontol gue muncrat kapok ya tante bo uniform resource locator
positive,bani oplos bikin demo nih by the way kitab umat islam lo
positive,andai ahok gubernur tutup rumah sakit uniform resource locator
positive,kurus yuk coli malam minggu kontol gay bahan coli uniform resource locator
positive,cebong bang akut komentar nomor wahid literasi valid dungu
positive,sih heran antek antek partai komunis indonesia muncul rintik rintik hujan
positive,mantap selamat 2019 ganti presiden 2019 presiden
positive,sontoloyo sih kecut
positive,tolol tulis kayak xf0 x9f x98 xb8 xf0 x9f x98 xb8 xf0 x9f x91 x8b xf0 x9f x91 x8b xf0 x9f x91 x8
positive,bodoh cerita cinta sepe imu nih tolol
positive,wkwk cebong dungu bicara cebong onta cangkemmu xf0 x9f xa4 xa3
positive,hai jongos nista agama muslim bangkit dukung jongos ahok
positive,jokowi pilih cerdas kali anak
positive,wkwk mampus salah gue blok jaman jokowi ahok calon gubernur gaya intip intip anies sandi uniform resource locator
positive,tai ayam hangat
positive,cerdas susilo bambang yudhoyono main kaki publik susilo bambang yudhoyono gabung koalisi merah putih usung prabowo hatta susilo bambang yudhoyono koalisi jend merah
positive,berengsek 2 jam muas tai keren banget nih film uniform resource locator
positive,potret rezim jokowi anti umat islam indonesia pimpin negara putar myanmar
positive,jokowi tommy republik indonesia 1 amp republik indonesia 2 cebong bunuh xf0 x9f x98 x82 xf0 x9f x98 x82 xf0 x9f x98 x82
positive,tuju gue bosan muak laku cebong nyinyir banget
positive,bubar dewan wakil rakyat bubar dewan wakil rakyat bubar dewan wakil rakyat bubar dewan wakil rakyat bubar dewan wakil rakyat bubar dewan wakil rakyat bubar dewan wakil rakyat bubar dewan wakil rakyat
positive,bangsa negara berani kubur islam said negara kalah aksi teroris
positive,indonesia alhamdulillah ya allah selamat anak anak thailand thai selamat manusia manusia kafir tuhan kontol
positive,xl gembel banget
positive,2019 ganti presiden solo
positive,pret kampret dukung 2019 ganti presiden presiden sapa rocky gerung kafir kah
positive,rezim anti islam pro komunis insyaallah saksi hancur
positive,nyata kakak kredit bahan nyinyir bu smi bilang utang ln surat pemberitahuan kakak kredit
positive,kerja cornelis tionghoa stres gila
positive,ah asa bukti nya muslim rohingya usir myanmar perkosa gadis buddha tanda nya bejat
positive,psi ai kagum diktator
positive,menteri sih orang kerja ketimbang senayan mending dewan wakil rakyat kerja rapat molor ruang ac
positive,jokowi sepe i karno lengser paham
positive,pakai wifi gembel
positive,gentong kosong nyaring bunyi mbak buai rayu syair syair nyanyi kadang buai dengar buai
positive,lihat cacing sarden cebong cari dukung ulama
positive,cocot
positive,maju duit goyang kaki pape duit nak maju kat bodoh uniform resource locator
positive,he pria bencong ideologi kiara a proyek republik rakyat cina damping langsung wakil pm republik rakyat cina kasih izin nya mantan atlet sakit keras hidup tenda korban bijak radikal ridwan kamil kayak bencong bicara ekonomi uniform resource locator
positive,sesat laku urus nahdlatul ulama sembunyi jahat islam
positive,senang lihat bela ahok nista alquran milik ghirah agama be obat sesat bela nista agama
positive,mental mobil kendara taktis kawal polisi sayang banget bis lempar molotov iya kayak jalan gatot subroto mental bikin nazar nikah monyet mental rusak stadion gelora karno aset negara proyek menteri wkwk
positive,anies sandi bentar bukti menang saracen
positive,usir cina jokowi radikal usir cina generasi bangsa mental rusak tumbang jokowi uniform resource locator
positive,psi mesra diktator jokowi peduli jahat timpa munir
positive,cari simpati umat muslim jabar pilih presiden 2019 mudah an ulama amp umat islam jabar kesima amp pengaruh trik gaya munafik sih mukidi
positive,umat muslim indonesia keras jokowi megawati rezim masuk kepala polisi republik indonesia kepala polisi daerah lengser jokowi
positive,ava gue anjing gue monyet aduh
positive,nama patrialis akbar status pidana korupsi dukung anies sandi
positive,lihat susilo bambang yudhoyono demo tangkap jokowi diktator lihat tangkap
positive,rezim diktaktor ekonomi cina sumpah setia undang undang dasar penghianat turun jokowi
positive,usir cina negeri kecuali cina patriotik kayak gue
positive,helikopter isi warga negara cina jatuh morowali sulawesi 2019 euy sabar 2019 ganti presiden
positive,kutuk maling maling negara karma
positive,buruk perilaku main disc jockey fariz kenal ketemu pilih presiden sutiyoso tau dukung kakak bin ngawur tolong ganti ava mu kasihan almarhum lopa km pakai wajah km
positive,biadab perempuan iblis
positive,geblek juta
positive,orang orang kayak laknat tangis rakyat pra merdeka kiamat gentayang arwah juang gelisah militan kerja ngawang kosong bolot
positive,jujur gue sulit lupa gue sibuk lupa lihat bangkai sih
positive,aduh cebong bicara sambung
positive,kang fakta ai dukung sih nista agama benci rakyat masuk rakyat jabar uniform resource locator
positive,wa awan kosakata gembel xf0 x9f x98 x80 xf0 x9f x98 x8a xf0 x9f x98 x80 xf0 x9f x98 x8a
positive,kalah tank nyata fighter assassin edan rak waras xf0 x9f x98 xaa
positive,coba suka maki korea pop banci heboh bicara drama korea maaf maaf ya nih mas mbak drama korea tonton idol
positive,blok sih bencong anjing xf0 x9f x98 x82 main unggah screenshot gue bencong tolol v laki ketemu adu jotos nyinyir unggah hasil screenshot v dasar bencong kontol xf0 x9f x98 x82 xf0 x9f x98 x82 xf0 x9f x98 x82
positive,susup ai demokrat
positive,rezim asai oknum oknum anti islam
positive,percaya hasut manusia iblis pandang xe2 x80 xa6
positive,congor oknum nasional demokrat sih joko kalah 2019 indonesia bubar
positive,dewan wakil rakyat dewan wakil rakyat daerah jancuk anjing anjing babi kontol jembut bajing bangsat tempek gendeng taeeekkk banci
positive,serah nasib bangsa orang orang abdi meng kacung cukong cukong asing penghianat negara republik indonesia modal dana kampanye 2019 ganti presiden
positive,buka busuk kubu anies sandi menang berkah uniform resource locator
positive,hati organisasi paham larang bumi pancasila bubar
positive,anak bangsa didik robot pe sembah nyembah allah subhanahu wa taala merintahkan rang bunuh kafir
positive,rezim paranoid bukti perintah rapuh rindu ria lengser istana ribu rakyat kepal tangan
positive,dengar bikin indonesia maju
positive,stigma babi milik tuhan sih ahok kafir
positive,tari cewek luwes cowok kunci tai
positive,asa walubi umat buddha indonesia usir bantai
positive,cium jokowi tajam cari uang ups salah utang uang salut uniform resource locator
positive,biru titit tebas
positive,sih banci bikin sensasi nih uniform resource locator
positive,bicara dasar ya nasrani kafir
positive,picek a mata
positive,ya allah babi dek malam jumat gilir gue jaga lilin
positive,sarap gue haha mentang april fool si day
positive,oi warga bawa bocah emak ya oke turun jokowi
positive,dalih 4 pilar majelis musyawarat rakyat dungu biadab bangsa dakwah islam seru sembah nyembah allah subhanahu wa taala benci kafir pecah bangsa
positive,also demo massa akbar lantik anies sandi batal wkwk
positive,facebook tai anjing
positive,dungu laku rezim dungu klop
positive,nyata sih a idjo batal tuduh hadap sih kunyuk tonton lagiiiiiiii
positive,tolong pe anyaan gue ya teman gue bilang debat orang kasih penge ian cebong kacung dungu tulang rusuk
positive,ya zaman susilo bambang yudhoyono korupsi jemaah senang
positive,rakyat merdeka on line gue bikin berita indonesia menang piala dunia kasih link kredibel alah cundang culun tampil identitas asli berani bacot monyet xf0 x9f x98 x82 handphone gue korea coy haha
positive,anjir berengsek bajing gila sih gue gange i sih nyata parah mantan gue anjir wkwk fokus exo bahagia
positive,wkwk gue bencong
positive,heran perintah jokowi budak kuli cina cina ahok kafir 9 naga
positive,anies foto ahok bera i nista agama uniform resource locator
positive,kayak sih abu janda event organizer acara deklarasi ulama muda kemarin sih faizal assegaf be indak event organizer nya aksi aktivis 98 palsu besok besok deklarasi lgbt deklarasi cebong dukung mukidi kenyang
positive,a ikelnya isi an 2019 ganti presiden
positive,persib butut soler goblok
positive,ah cebong
positive,aimu partai demokrasi indonesia juang bajing
positive,rusak bela heran lihat perintah
positive,abu gosok janda dungu presiden malu malu jokowi
positive,08 for presiden jongos antek asing uras bumi pe iwi 2019 ganti presiden
positive,jancuk
positive,sayang banget ya lihat perempuan kayak status tempel laki laki aduh nagita slavina blak blak ayu ting ting kampung xe2 x80 x93 viva uniform resource locator
positive,ireng kafir anjing
positive,hang event majlis buka puasa hang puasa bangkai
positive,lini orang putih babi pe ikai azan sih hindu divya nih azan orang bodoh jerit jerit loudspeaker orang cirit orang petik agama play korban bodoh
positive,cocot xf0 x9f x98 xa4
positive,jam ih aisya nya lesbi xf0 x9f x98 x83 ioixonemakrab
positive,alquran kitab sampah berani lomba nyanyi alquran
positive,hujat munafik non
positive,ajar aji ayat cocok cocok penis penggal kafir pahala biadab
positive,haha rezim usir maling pakai duit rente bangga utuh milik negara sepakat bodoh rakyat hilang percaya hehe
positive,najis mugholadoh
positive,jepit kontol gue pakai memek
positive,nor azam azam gila haha
positive,hasil nyata lindung ahok dakwa nista agama
positive,medali ujung ujung ajak teriak kafir lengser
positive,panik ahok sih kutil babi tumbang putar cuap cuap mu media sosial pengaruh
positive,monyet komunis tolol
positive,kayak tai mencret anjir
positive,massa kerumun malam sengaja provokasi rusuh ciduk lempar tuding perintah pro komunis ah basi
positive,speaker parlemen hutan rimba speaker ungka ahli hormat kepala monyet i beruk beruk nyanyuk kera kera makan parlemen malaysia umnobn parlemen hutan rimba taman negara
positive,indah tai sapi mata picek xf0 x9f x98 x84 xf0 x9f x98 x84 xf0 x9f x98 x84
positive,bu guru cebong nyata
positive,nya gampang presiden mu hina cina bangsat diam sih munafik bisu 2019 ganti presiden
positive,sarap nih orang
positive,citra lemah polos terima kalang rakyat orang cilik sadar kibul modus sederhana sih kaos oblong sandal jepit presiden 2019 ganti presiden
positive,tugas umat islam indonesia berat tegak hukum lengser jokowi
positive,dasar bajing xf0 x9f x98 x88 bini bujang pelan pelan sakit hancur asa mama ku mama ku xf0 x9f x98 xac pulang ku banting handphone
positive,edan pbg purwokerto ngeles
positive,bokep auto no titit teman lulove
positive,tau bicara tumpas partai komunis indonesia komunis antek serang ya serang partai komunis indonesia partai komunis indonesia lindung partai komunis indonesia
positive,mampus
positive,suara cebong kolam xf0 x9f x98 x81 xf0 x9f x98 x81 xf0 x9f x98 x81
positive,xf0 x9f x98 x82 xf0 x9f x98 x82 andre onta mate hajar
positive,simpul cuci tangan cari selamat ya berengsek uniform resource locator
positive,agus provokasi rakyat tuhan anggap setan ai amin periksa jiwa
positive,dungu budak islam tiada tuhan merintahkan salat allah subhanahu wa taala biadab
positive,babi maju anjinggg
positive,11 gb raib curi sedia kampret
positive,ai tolol indonesia pimpin kafir ya catet
positive,komisi nasional hak asasi manusia sontoloyo
positive,buddha teroris uniform resource locator
positive,ahmad dhani hormat babi anjing kontol lonte tunggu nya karier mu habis
positive,direct message sis zon bilang kampang kesal bangsat
positive,kemarin siantar copot spanduk mu curi curi kampanye demo panitia awas milu nih sih djarot main curang kampanye demo buruh tindak pasang calon curang no 2 keren register 40 pilih gubernur sumatera utara 2018 pilih kepala daerah sumatra utara
positive,injak suka bash tipu lelang acc hidup kayak jijik jual apps eh jual apps v mending jilat telapak kaki gue dex
positive,mabuk pil pcc
positive,ya kali ketemu bobotoh viking kaos the jak pikir
positive,daddy jahanammmmm sanga kutuk kooo
positive,anjing hina rebut jabat k e b o h o a natural killer e b o h o a natural killer e b o h o a
positive,direct message kayak verifikasi kunyuk hai hai
positive,antek antek orde hobi isu partai komunis indonesia jahat orde asing kaya alam sepe i freepo as kerja me ua prabowo
positive,menteri agama omong doang ayat rampas halal allah subhanahu wa taala janji rampas salah buang
positive,kafir musuh munafik bunuh
positive,bego teman gue najis kesal gue
positive,sih bejat cabul kriminal oceh kriminalisasi ulama dasar munafik
positive,beda 1 cocok keparat xf0 x9f x98 xa4 xf0 x9f x98 xa4
positive,xf0 x9f x98 x82 xf0 x9f x98 x82 xf0 x9f x98 x82 xf0 x9f x98 x82 xf0 x9f x98 x82 xf0 x9f x98 x82lu banci ku cewek takut serang cewek sembunyi wajah mu
positive,mata picek
positive,haji tipu ibrahim kubur kabah biar rakyat tipu lukman
positive,sabar tunggu 2019 kebelet ya prabowo
positive,donatur 212 bajing uniform resource locator
positive,duta myanmar berani usir besok habis salat gerebek duta buddha indonesia gagu
positive,cebong goblok xf0 x9f x98 x82 xf0 x9f x98 x82 xf0 x9f x98 x82
positive,antek komunis biadab jongos cina
positive,penjara nista agama turun hypertext transfer protocol over secure socket layer t co vqh0tnxarz
positive,ah cebong
positive,dewan wakil rakyat butuh dukung kayak nya nih hak nyata lengser jokowi daulat tangan rakyat serah rakyat
positive,front bela islam renovasi masjid ahok kafir kristen urus masjid masjid hubung
positive,rahasia bong koruptor rampok laku maksiat laku bisnis maksiat kaum lgbt jilat dukun sesat dukun cabul nabila bla bla gabung bani cebong
positive,boro boro cacat
positive,masuk teror aparat inimah keparat politik bahasa mafia politik hati hati bos takut ancam intimidasi demokrasi polisi republik indonesia kucing
positive,xf0 x9f x8c x9a km bangsat iya
positive,salah amp bilang antek asing adik prabowo bilang prabowo pro amerika uniform resource locator
positive,najis ya allah seram
positive,cina ahoker berani bayar pribumi aparat aparat korup legal aktivitas cina bangsa suku indonesia usir cina
positive,tua dongok
positive,bacot banget bangsat
positive,tuhan pilih gubernur lari arab ya cong nelo bencong otak idiot hina banget hidup ya cong
positive,imajinasi ngewe lini gue kena dare nih
positive,a inya pribumi sadar lihat kecuali cina komunis misionaris abai twit usir cina indonesia
positive,keliru manusia tuhan tuhan layan pamer kuasa surat pemberitahuan ajar alquran
