hs_class,text
positive,haha nyata dukung kumpul bani onta sumbu pendek xf0 x9f x98 x82 xf0 x9f x98 x82 xf0 x9f x98 x82 selamat nikmat pimpin presiden nmantapkan 2019 pilih jokowi
positive,congor rusak muak orang lihat orang
positive,iya ya monyet anjing gue gampar kesal astagfirullah azim bicara kasar maaf kali ngentot uniform resource locator
positive,bantai buddha teroris rohingya manusia
positive,bayang asa mbak memberitahu beliau disabilitas balas mati bajing xf0 x9f x98 xad xf0 x9f x98 xad xf0 x9f x98 xad
positive,tuju ahok gelar santri hormat santri hormat babi uniform resource locator
positive,partai komunis indonesia gaya jokowi antek komunis
positive,ah asa hibur cebong bahagia presiden cebong tol cebong germo xf0 x9f x98 x82 xf0 x9f x98 x82 xf0 x9f x98 x82
positive,jgb mimpi kroco kroco impor stok
positive,marwah kampus rejim biadab nyungsep amin
positive,kantor kepung massa takut kuak pokok ganyang partai komunis indonesia
positive,akun komunis
positive,heran gue orang hijrah pakai jilbab nyinyir cocok aura cantik mon maaf pakai jilbab kontes cantik pakai bicara aura hhhh cebong nge i
positive,sahabat kayak tai
positive,mention gue genap ya bong mention gue ras masuk kakus cebong dungu berfollower 2 digit
positive,cocot
positive,bubar acara partai komunis indonesia
positive,habis pikir fanboy ahok bego bego ya nge i sejarah gampang jebak iklan maaf ya
positive,44 gerombol rizieq front bela islam main isu perintah jokowi pro partai komunis indonesia
positive,tenaga kerja indonesia wanita jongkok hina hina babu congor be ulang manusia kampung
positive,hina malu fasilitas perintah bikin bani daster tau malu harga makan gaji negara hina haram
positive,tipikal kaum belah persekusi umat agama zalim kuasa
positive,iya tante jablay wkwk
positive,setan gue nyanyi
positive,al alquran ya bang mulut kayak orang kafir bejat hina farhat abbas law
positive,ya gue kasih tau bang kasar ya keset jeyepe sombong tai onta
positive,tenggelam kunyuk penghianat hancur bangsa a uniform resource locator
positive,bangsa bajing anjing babi goblok
positive,manusia suka sontoloyo model
positive,jodoh tang tuhan mantan tang setan
positive,budek kayak bolot om kuping nya kotor sepe i hati
positive,bubar amp usir yordania
positive,ya allah jablay bawa bawa sih fia haha xf0 x9f x98 x82 iya jimin cuteness nya nih sial
positive,mampus kenang haha
positive,allah hu barbar perintah penggal kafir bang fahri allah hu barbar ajar cocok cocok penis
positive,pantat balita bopeng iya
positive,gue ngemafia main 3 acc edan
positive,cebong dungu kalah gila
positive,tai
positive,mohon bantu saudara saudara ahmadiyah depok masjid segel perintah daerah pilih presiden coblos jokowi
positive,sampean sarap ya impor pesawat papa impor garam bayang indonesia isi garam garam impor dasar otak ampu kaki
positive,diskusi bilang bangkit partai komunis indonesia bela partai komunis indonesia paksa tuduh antek komunis
positive,persib nya jelek persija bagus sih goblok
positive,2 anggota dewan wakil rakyat daerah sableng geblek contoh guyon pidana pintar blasss
positive,maju anjing uniform resource locator
positive,lamun jokowi presiden angelus eta bandara paham tau tolol pelihara
positive,berisik jablay nya hebat
positive,yaaaelaaaaaa manusia babi dasar
positive,berengsek nih orang tua tobat episode 31
positive,ih kontol
positive,bera i rejim jokowi ganti ah
positive,paksa tanam van den bosch ambil hasil jual belanda via voc hasil korup voc sayang merdeka pin hasil panen salur badan perintah amp korup jabat bangkai
positive,manusia kafir twit nya surat pemberitahuan xf0 x9f x91 x86
positive,sok polos genit kayak banci
positive,ganti nama biar cocok mulut sampan onta kencing
positive,gojek 2019 ganti presiden ayo viralkan cc
positive,jambu bol halus jambu bokong
positive,gue ketemu anjir gue
positive,jam kampang ya ganteng banget ih
positive,bangkai wkwk kayak habis putus ngiang ngiang mandi kucing eeeeeee
positive,al alquran sunah merintahkan rang kafir akibat pecah belah bangsa
positive,kampung banget
positive,bencong ivan percaya aduh kakak nya rebut laki orang bangga ya iya bilang hidup jujur jujur dese hobi boboin lekong mulu saban bal
positive,ai sontoloyo
positive,aduh jujur bohong
positive,bacot diobok obok
positive,anjir covernya wkwk
positive,eh gue geblek teman pintar ya bera i gue geblek xf0 x9f x98 xa9
positive,telepon kampret yakkkk nyata tolong sekarat
positive,bodoh dasar noob ramos nih jijik
positive,jokowi jongos luhut
positive,oke barusan banget malam jumat workout kamar tidur pas angkat angkat kaki dengar suara samar samar kayak tertawa doooong mampus
positive,bang fuck ri susah deh gilir lembut garong ikan nyinyir pro asing asing asong nla coba mbok kasih bocor prestasi km bikin indonesia bangga
positive,kecewa on silvy malu fitnah ahok panas sekak mat debat final pilih kepala daerah jakarta
positive,xe2 x80 x9clagi tren thailand cebong nge i xe2 x80 x9d sotoy banget nih lumpur hidup
positive,ciduk indra piliang rawan anies sandi tangkap narkoba loh uniform resource locator
positive,jokowi kasihan goreng pbb
positive,islam titik masyarakat sadar islam bahaya titik
positive,alhamdulillah gubernur gagal amp bobrok ganti gubernur muslim insyaallah 2019 ganti presiden lelah juang niat ibadah nikmat juang lawan pimpin zalim
positive,thailand negara asia cowok kontol uniform resource locator
positive,tai gue banget amp kejar kejar gue eh pas gue sayang nyaman cuek amp pergi
positive,pakai lengser sih jokowi
positive,prank level tai anjing uniform resource locator
positive,hai bicara pakai data by congor doang nasionalisme bela tenaga kerja asing dasar
positive,kritik jokowi anggap nyinyir bani kolam kritik ujung dukung 2 periode lo kritik dukung a inya nyinyir haram definisi kritik ala cebi nalar rusak parah
positive,akun facebook asma dewi sebar fitnah sara pilih kepala daerah jakarta penuh foto politis anies sandi
positive,partai bangun tumpang ya 2019 ganti presiden
positive,kutuk banget pokok niat jahat
positive,ngeles om anies sandi
positive,rak tau teman teman pintar kayak bego begoin mempan
positive,jokowi komunis kapitalis uniform resource locator
positive,ajar rayu jokowi menteri barangkali
positive,bu silvy anti pegawai negeri sipil level rendah debat final pilih kepala daerah jakarta
positive,ahok bebas korban sasar lengser jokowi tuju tawar syariat momentum fatwa majelis ulama indonesia demo 411 212 313 radikal
positive,alaaaahhhhh omong cebong arah pakai tol kelok 1000 sok sok islam bong
positive,gue geblek teman gue pintar tau deh
positive,sayang ketemu jepit kontol uniform resource locator
positive,indonesia cerita anggota dewan wakil rakyat tunggak bayar listrik anggota dewan wakil rakyat jual kaos anggota dewan wakil rakyat ganti presiden kaos parah rakyat goblok ganti presiden tagar doang lucu
positive,bro psi isi sontoloyo bro salah lindung usaha
positive,jilat pantat rizieq kayak
positive,anak sekolah zaman now masuk culun lulus orang dungu
positive,pilih kepala daerah daerah khusus ibukota penuh intimidasi hasil sah anies sandi kampanye janji janji palsu batal angkat anies sandi
positive,ayo 2019 ganti presiden tuju bang eh ganti goblok tolol kunyuk ya cari bareng bareng kocak nooo bang drama kumpul celeng dungu
positive,rakyat tolak keras indonesia pimpin komplot mafia amp bajing uniform resource locator
positive,wasit goblok sah goal
positive,tau sih cantik kagum tengku zul kacrut
positive,iya iya hidup nabi jokowi as
positive,galakin pribumi negeri teriak usang asing gongseng gilir hadap hadap langsung usang asing asing gongseng loyo
positive,ngoaaahahaaa saking kejang kejang nya sih bani kuda prabowo bin onta baca tulis gue selingkuh kuda prabowo ngoaaahahaaaa xf0 x9f xa4 xa3 xf0 x9f xa4 xa
positive,ngentot tante xc2 xb2 oma xc2 xb2 uniform resource locator
positive,dukung surat pemberitahuan arb sda orang orang bejat tabiat kasar masuk orang moga laknat allah
positive,haha geblek duit ginting salah beli produk
positive,ahok jeruji demo rumah tahan demo jokowi amnesti grasi kasih lengser jokowi salam
positive,diam anjing daniel edan ya
positive,cupu bawa bawa squad
positive,orang udik sok pintar ya congor
positive,pasu onta 212 pimpin berengsek buron nikmat hasil bahagia nikmat uang haram
positive,sih dongok tumpang makan rakyat kerja nyinyir
positive,xe2 x80 x94 cape gue ajar bentar gue nak berak wkwk kunci motor motor sompret greenteaaaaa pocky green tea pejuh green tea i love biar tinggal gue sih cerita nya gue mute
positive,bani marah ajak obrol lari kesana kemari cari alas
positive,hutang gede rakyat susah iya alay politik
positive,kaum 1 2 kafir radikal serang pusat pe ahanan umat islam kaum 1 2 kafir percaya otak junk food nya kapasitas zero waspada adu domba kaum 1 2 kafir
positive,gila ndro pelepasa xc3 xb1 saham proklamasi merdeka saking pintar rangkai keblinger nih bani onta
positive,topik bicara cebong bani hoaks loncat xc2 xb2 ya prestasi babi ahok tanah abang ta kasih contoh ta xc2 xb2 buruk
positive,rakyat paham hoaks nya golong kampret rakyat paham kerja perintah dasar sampah
positive,negara teroris nyata mayoritas buddha
positive,indonesia mundur bentuk
positive,idih modar
positive,bolot ya
positive,ngentot pacar hotel ngentot anak gede sange toket gede abg bugil tante sepi memek becek tante bugil uniform resource locator
positive,tenaga kerja asing cina manja
positive,manusia homo
positive,men are sampah wkwk jap daler pahal orang cacat
positive,manis manis idiot nih orang
positive,celeng
positive,komunis melulu ditii bahas bantai berontak antek teroris nyata
positive,ribut komunis bla bla emoh baca baca niat agitasi serang perintah pakai cari simpatisan
positive,moga aparat aparat keparat karat blangsak sisa hidup
positive,double fuck kontol uniform resource locator
positive,bencong teriak bencong
positive,pilih dewan wakil rakyat bubar
positive,kyulkyung visualisasi edan
positive,iya citra unggah unggah dihhh personal nya salty in jiun mulu sompret
positive,anjir
positive,orang gendut kontol mitos fakta p fetish latex p uniform resource locator
positive,hina ahok xf0 x9f x98 x81 xf0 x9f x98 x81 xf0 x9f x98 x81 orang tau sih ahok congor kali xf0 x9f x98 x81 xf0 x9f x98 x81 xf0 x9f x98 x81
positive,nih bicara orang ingus bicara nya ngawur nya gue blok banci uniform resource locator
positive,moga laknat allah rusak islam
positive,najis om om inggu nyata
positive,orang gila
positive,paksa rakyat pikir teroris pesan politis undang undang rakyat keparat gaji xf0 x9f x98 xac
positive,rep help lelang acc mata picek mentang mentang nama iya bilang gue usn
positive,kenal besok bilang asma ahoker susup kubu anies sandi
positive,puasa sok sok cerita buka kantor ngentot fuck citra yosy bin o
positive,suka banget emut kontol gede
positive,buka lihat bohong bohong jokowi laku hadap rakyat orang tipu sepe i pimpin
positive,putus erka hormat pilih ai dukung nista agama
positive,cina usak bangsa usir tuju
positive,hebat ya bilang munafik cermin xf0 x9f x98 x82 xf0 x9f x98 x82 xf0 x9f x98 x82 xf0 x9f x98 x82
positive,otoriter label pulang pulang tinggal nama
positive,bunda geblek
positive,anjir pikir kocok ya
positive,ganteng ganteng sarap xf0 x9f x98 x82
positive,alquran kitab sampah zakar sila ban
positive,otak cebong 1 susah iya baliho jokowi kampanye sembako pakai anggar belanja negara waras
positive,ai ai gaduh oposisi henti gaduh jaman susilo bambang yudhoyono diam korupsi aman
positive,imajinasi gue titit pala peang bekas jahit rapi bekas luka jepit ritsleting bengkok gemas xf0 x9f x98 x8d
positive,bikin resah lini sih monyet kafir
positive,bencong teriak bencong
positive,dungu idiot tambak
positive,bicara kayak orang berak
positive,ayo viralkan malu nyata fitnah hadap warga kampung akuarium ban nyata gubernur daerah khusus ibukota jakarta anies baswedan 24 warga tinggal dunia tinggal bekas gusur
positive,cocot
positive,gembrot banget
positive,cebong pindah on masuk kemako brigade mobil
positive,joget raffi ahmad ayu ting ting bilang norak kampung nagita slavina kronologi uniform resource locator
positive,haha mampus selamat galau ria
positive,banget lelaki berengsek dunia mudah mudah masuk ya uniform resource locator
positive,massa provokasi be eriak ganyang partai komunis indonesia
positive,cebong nge i
positive,udik gay
positive,hai kontol kangen km line nih
positive,bani kampret ya nafsu kuasa korupsi jemaah sepe i kader partai adil sejahtera gubernur sumatra utara
positive,cina hak larang
positive,manusia homo ngewe
positive,bajing silvy debat final pilih kepala daerah jakarta
positive,indihome kacrut saking kesal teknisi kali cek pergi solve 7 pakai katebelece orang direktur jenderal tulis koran kompas 1 jam langsung beres ngehek
positive,deh gue suka cowok lawak xf0 x9f x98 x82 sungjin jae lawa krik member born to beat lucas cowok bejat bejat wkwk lihat bad boy main mata asekkk wkwk
positive,negeri sontoloyo status hukum nya
positive,i just sadar admin gerindra antek bego sengaja susup biar gerindra lihat bego media sosial
positive,ahok penjara kutip kalimat kitab fiksi aneh bela agama ahli surga serentak bela sih dungu kitab suci fiksi
positive,gembel bengal ya
positive,pick we get love doang mata picek pas pick
positive,sih cebong makan tahi jokowi sadar jokowi indonesia ubah indonesia cina
positive,salah kaum cebong situ kaum cebong
positive,nyata anies sandi libat saracen uniform resource locator
positive,jenggot bajing
positive,lihat umar umar ahok amp busuk lantang hina agama
positive,iler ri 1 prabowo maksud haha
positive,sayang ganti pakde jokowi nojo edan lo jon rumah sakit jiwa bak
positive,iya cebong cina komunis cinta sih jamban
positive,orang turun cina gubernur indonesia bicara orang padang presiden singapura
positive,pintar bego
positive,sih positif mulut oi badan kayak ikan buntel isi negatif sampah
positive,bentuk bani togel gera oke cukong tunggang agama bukannn xf0 x9f x98 x81
positive,cebong gila ngamuk ngamuk bela sih homo nista agama haha
positive,indonesia mundur pimpin jokowi uniform resource locator
positive,nyata manusia orang busuk busuk bangkai apes apes
positive,turun jokowi ayo mahasiswa nongkrong televisi tonton acara alay leluhur panggil
positive,bangsat gue bilang buya yahya gue yahya alias yahya staquf bin yahudi arah gue k yahya staquf amp sih aqil gue tau masuk gerombol setia na simpang
positive,himpun tai iblis
positive,nomor 1 sok tau langsung sekak wkwk debat final pilih kepala daerah jakarta
positive,ahok calon gubernur demo
positive,bukti radikal an hati front bela islam bukti orasi orasi hati front bela islam fitnah caci maki hadap perintah polisi republik indonesia ulama kiai kiai dasar otak bebek pura pura buta tuli isi otak junj
positive,ekonomi pegang gerindra hancur negara masak saran cetak uang bayar hutang hutang utang negara bilang biaya produksi cetak uang murah ekonomi comberan kecoa
positive,kampret
positive,setan moga mencret 3 minggu be urut2 lindas truk suhu
positive,dagang aneh nyata nya harga puluh ribu kilogram nya nasional idul fitri lebaran puluh ribu aneh nya beras murah rezim aneh
positive,bujuk setan hasrat jebak zaman
positive,kabar memek tembem
positive,cebong bang
positive,usir cina bala mongondow juragan ng
positive,gembel sok elite ngewe sari ayu halo mas kelas kambing main gue 2001 main hotel jayaka a tematik klasik malio x2 sumo samping tutup alexis ah main cebong kelas kambing cc
positive,kritik prabowo perintah jokowi produktif blunder simpati dukung
positive,foto doang anak idiot kayak xf0 x9f x98 x82 xf0 x9f x98 x82
positive,woyyyy bangsulll peang goblok anjirrrrr blok gueeee cukkkkk
positive,ih pintar gembel nih anak
positive,eh kunyuk embat dana umrah diam ya
positive,rakyat cina rakyat indonesia anak turun partai komunis indonesia paham uniform resource locator
positive,kemarin galak galak bicara sibuk klarifikasi dasar bajing
positive,mampus
positive,nek lihat match chelsea sih menang mudah manchester united iya embuh sih chelsea kacrut ki prediksi xf0 x9f x98 x82
positive,hamil haha gembrot lucu banget
positive,ulama reaksi hadap gila hina islam nila dunia agama
positive,ayo memek
positive,kuak strategi kampanye tim menang anies sandi uniform resource locator
positive,mampus sangkut om om
negative,lie tju siswi kelas 6b sekolah dasar katolik karya yosef istri ronaldo pardede sah
negative,saudara aji moga allah izin gus ipul mbak puti gubernur wakil gubernur jawa timur saudara aji kota batu saudara aji jombang jombang gemerlap
negative,vivo v9 grand launch siar langsung candi borobudur 12 stasiun televisi nasional saksi padu sempurna teknologi mutakhir budaya fashion 29 maret 2018 jam 8 malam vivo vivo vivo
negative,patung tugu tawar besanding lokasi simpang kampung kagungan ratu camat tulang bawang udik lampung tebak gambar im3 ooredoo
negative,presiden harlah 58 gera mahasiswa islam indonesia gedung sabuga bandung selasa 17 4 calon pimpin milik optimisme tahan uji tahan uji tahan banting amp tawakal serah allah usaha
negative,1 gubernur relasi dahsyat gubernur presiden bagus amburadul
negative,wkwk bayang monyet kera sakti xf0 x9f x98 x82 xf0 x9f x98 x82
negative,badan selenggara jamin sosial rugi usaha listrik negara pe amina rugi negara rugi aneh presiden hebat kalah tukang pisang omzet triliun dagel
negative,tuan guru bajang bukti umara ulama nasionalis religius nasionalisme ragu beliau orang cucu pahlawan nasional dedikasi negara republik indonesia tuan guru bajang indonesia 2019
negative,tomohon rupa pusat ajar agama kristen katolik khusus doa meditasi bukit kasih buah suci indah tenang tomohon international flower festival
negative,buya eson substansi baca qur an hayati bumi pesan qur an islam rahmat alam tes baca lihat track record set
negative,badan kuliah bohong dosen fakultas besok lulus kuliah km pimpin negara tung presiden anak anak sepe i dosen
negative,sebar aman jagat
negative,haha front bela islam islam
negative,iya bahasa asing
negative,hutang belanja dewan wakil rakyat ri tuju anggar belanja negara dewan wakil rakyat ri kontrol efisien efektif boros rang korupsi bantu perintah baca rakyat indonesia pend pajak
negative,afgan sukses takluk bandung sides indonesia tour 2016 via
negative,4 presiden jelang selenggara publikasi luas rupa media nasional internasional jokowi pacu promosi asi games ayo promosi asi games 2018
negative,iya mas orang kristen nyanyi jingle bel keren
negative,ogah gue pilih pilih lesbi kawin
negative,pe rezim bijak protes nya kuasa pura pura dengar paham kritisi a
negative,98 1 orang orang kafir ahli kitab orang orang musyrik tinggal agama bukti nyata
negative,presiden tekan bangun infrastruktur daerah duga bagus kembang ekonomi fokus kota kota
negative,debat publik ajang bukti pintar ruang akademik pamer indah orang kuat lemah egosentris nama kuat tahan l
negative,fakta mega proyek bangun bandara ajati lupa atur daerah provinsi jabar no 13 2010 gubernur bangun presiden susilo bambang yudhoyono 70 dana bangun anggar belanja daerah jabar klaim sepenuh te
negative,sis request kat nak 8 bodoh je bi hday natang nih sis happy buka tengok tegok iphone alaaaa sis maksud s8 iphone 8 my salah 8 je xf0 x9f x98 x82 xf0 x9f x98 x82 pergi tukar x minat apple iphone eeyewwww uniform resource locator
negative,kristen atur injil manusia cipta akal pikir beda buruk patut patut te ulis injil bera i dil
negative,indonesia anti ungkit ungkit partai komunis indonesia cari presiden kait buruk simpel indonesia bangkit 2019
negative,tes presiden ri gubernur indonesia sih gue
negative,atmosfer adab patriarkal lelaki penis atribut maha transgender perempuan transgender perempuan anggap khianat serius hadap lelaki uniform resource locator uniform resource locator
negative,hadoiii menteri susah islam senang liberal senang ateis senang lgbt kelak akhirat teruk kena bantai puak ph nih iman rukun iman iman jaga islam
negative,sih aksi simpatik pakai poster bom pakai bunga
negative,ulama sejuk bangsa
negative,pas bom surabaya kemarin ngepost positif dukung tentara nasional indonesia polisi republik indonesia kecam banget teroris gue lihat cewek cewek cadar kejar oppa oppa korea airpo wkwk sih gue cewek cadar fanatik banget penamp
negative,meja lemari lempit kali kali sapu biar naung kecoa tai cicak
negative,emil dardak pimpin milenial calon wakil gubernur jawa timur
negative,budaya demokrasi amerika serikat maju indonesia rakyat beda privat publik paham pesawat presiden lekat lembaga presiden sangkut selamat amp aman presiden
negative,tuju 2019 kiprah orang sus pudjiastuti dipe anyak menteri ikan usaha lang tuju kursi wakil presiden amp a laut kolam sus rabu 18 4 19 30 indonesia barat
negative,muhasabah jap no
negative,cina agresif ambil alih saham saham usaha tambang dunia cina ambil alih saham tambang milik freepo negara cina taruh minat milik newmont freepo kuat rantai supply i
negative,jaman kuliah menu ampas enak magelang masak mas
negative,risiko kena pneumonia akibat vape daulat rakyat budaya teliti berita
negative,selamat pagi selamat semangat aktivitas salam 2 periode jokowi presiden joko widodo jokowi catat rampung 30 proyek strategis nasional play station network hitung 2016 2017 jokowi 2019
negative,agama kristen ajar hakim sila agama sobat
negative,buaya tunggu
negative,xc2 xb2 haqqul dukung prancis hasil survei menang kroasia xf0 x9f x98 x80 xf0 x9f x98 x81 xf0 x9f
negative,nun bom
negative,lihat jijik
negative,bom bunuh teroris bunuh jihad dukung antek teroris bela
negative,orang kristen hidup beda orang orang dunia kabur cermin mulia allah saksi kristus harold freligh
negative,kang konter rumah wkwk koko koko sipit xf0 x9f x98 x82
negative,islam bela nista agama kedok juang ham hamburger kali orang tau check it out ustad
negative,cebong
negative,musyrik a inya tiada lawan tauhid a inya bangbang wetan april
negative,mengelibut pagi buta
negative,gubernur daerah khusus ibukota salat jumat erdogan
negative,pikir ya salah rezim
negative,ramai buta mata buta hati salam jumat people
negative,alamak jumpa gambar salah orang pimpin juang melayu islam umno bn nasib clubbing kat tangan gambar pimpin bn nak
negative,pe perang twitter meng mensyiahkan orang israel meng yahudi yahudi orang iran mabuk wkwk
negative,sampah visual kondisi
negative,iya habis aktif lihat lini asing suasana hati hilang
negative,alot ifikat halal nya komponen mikro tengara sentuh babi alami dekomposisi molekular atomik cap haram najis alami proses dekomposisi molekular ramai nih
negative,gue bom otak tai tau dek dekan nem alah wkwk
negative,alhamdulillah dukung kalah sontoloyo klub idola orang tau muncul akibat lampias amarah sayang oknum lihat laku puasa xf0 x9f x98 xa2
negative,closed agency membernya kenal biar asing
negative,ide bagus noon next kasih bunga bangkai ya tolak
negative,nenek panggil emak cerita pemuda etnis tionghoa medan bunuh bioskop preman peristiwa 1965 persis kayak film joshua oppenheimer rachel hubung pindah emak keluarga jaka a 65
negative,jelang pilih kepala daerah perintah kabupaten garut kebut cetak 116 ribu e kartu tanda duduk
negative,teman teman kantor langgan cadar langsung bilang awas bom hela nafas xf0 x9f x98 xaf
negative,ntt maju mari ekonomi perempuan pemuda desa emi nomleni calon wakil gubernur ntt 2018 2023 marhaen marianu semi nusa tenggara timur marianus emi semi front april salam jari partai demokrasi indonesia juang
negative,thailand tuntut ilmu tinggal gereja kristen bantu bantu sekolah anak pintar bawa medali sekolah
negative,pnh kerja asing manfaat terap sekolah dominan enggan
negative,jawa timur anti berita hoaks pilih kepala daerah aman damai
negative,heran deh ya cape lari lari pikir
negative,gubernur presiden lihat wibawa berani tatap lawan bicara penuh percaya beda banget
negative,ya lucu nada manusia manusia kena pecah bom cacat umur hidup semb
negative,kristen nama denominasi kelompok akulturasi budaya indonesia gereja kristen jawi wetan jawi wetan huria kristen batak protestan batak gpib ya kristen nusantara unik bhineka annya
negative,duh istilah pepatah tiada kenal mk tiada sayang pucuk cinta ulam jodoh
negative,mohon blokir akun provokatif pecah belah akun bayar antek dolar cc
negative,main framing urus data ekonomi paham owa
negative,deklarasi pilih kepala daerah 2018 aman anti hoaks perangkat desa keboguyang jabon
negative,muka arah sungguh orang orang yahudi nasrani al kitab taurat injil
negative,xe2 x80 x9cshalat berat orang orang munafik salat isya salat subuh bukhari 141 berat lang jamaah isya
negative,kuat fitnah menteri agama lgbt haram lebai fitnah suci manifesto ph stabil harga minyak next generation network subsidi harga minyak tanggung raja
negative,mak allah mantapppppp eittsss bangga euy gubernur indonesia
negative,salam pasek sistem kembang kampung budaya bal advokasi alih hak komunitas rumah adat minangkabau aset daerah rangka kembang wisata
negative,salah nabi hud nabi hud tradisi arab islam padan tradisi ibrani yahudi
negative,perhati nada kelompok garap film komedi trik raih perhati tonton peka alhasil film lucu mata orang bom takjil
negative,rakyat menge i lihat agama teror bom aksi teror kuasa republik
negative,algaka pilih kepala daerah kalimantan timur 2018 tumbang komisi pemelihan rau
negative,gue asa orang bejat ya
negative,pasang calon gubernur wakil gubernur pilih debat buka pilih gubernur jawa 2018 malam
negative,benah alon alon mu do mayak kick off blayer blayer wira wiri bawa genderuwo nama geng xe2 x80 xa6
negative,kah ganti kafir 2k17 2k19 syiah jil komunis
negative,presiden soeha o resmi museum taman mini indonesia indah
negative,risa pulang latih khusus iris hazel milik tangkap siluet orang gadis gadis asing risa temu gadis radio tinggal kerja r
negative,be emu ulama jabar presiden jokowi ajak ulama a perintah sejuk suasana jelang pilih kepala daerah serentak 10 4 18
negative,partai komunis indonesia
negative,biar gubernur daerah khusus ibukota selesai tugas full hasil kerja krs beliau salam 5 5 sabar selesai jabat amanah rakyat susah payah anies muda jalan jaga insya
negative,asing
