hs_class,text
positive,eh onta tolol kasihan orang tua lahir ekor binatang sepe i mu dasar kaum bumi datar partai adil sejahtera laknat
positive,bajing line
positive,sakti jubah kuasa tunggu rakyat marah pecat setya novanto pecat ketua dewan wakil rakyat
positive,seyogyanya benci ilfeel keparat otak sumbu pendek modal sandang
positive,usir nih cina ki gila pamungkas bui gara gara anti cina cina tumpang negeri uniform resource locator
positive,iya kampang
positive,bohong rakyat harga mahal bayar hadap korupsi solo daerah khusus ibukota layak presiden ri 2019 ganti presiden
positive,ejek monyet
positive,biadab banget jokowi konspirasi musuh musuh islam
positive,maksud domba idiot akun xf0 x9f x91 x89 xf0 x9f x91 x88
positive,buang islam sakit laku manusia
positive,dungu idiot permanen
positive,eh cina setan tumpang makan indonesia enak nya
positive,rebut saham pegang saham tabok pakai duit hasil utang dasar bani kadal kadal selesai selesai
positive,3 anjing enak banget sih ganteng be sodok kontol gue xf0 x9f x92 xa6 xf0 x9f x92 xa6 uniform resource locator
positive,pro asing jok uniform resource locator
positive,suka citra laris piala citra versi kecebong kolam na inya cari makan hidup hasil jilat master kecebong peduli master cebong goblok kolam
positive,1 periode blangsak 2019 ganti presiden 2019 presiden
positive,kafir partai komunis indonesia samar islam jelek jokowi kafir partai komunis indonesia
positive,kristus anjing anjing jembut keparat picek tai pejuh siwuk kutang siwuk idiot keparat picek tai pejuh siwuk kutang siwuk idiot keparat picek tai pejuh siwuk kutang siwuk idiot keparat picek tai pejuh siwuk kutang siwuk idiot keparat picek tai pejuh siwuk k
positive,janji jokowi janji ala kompeni konser iwan fals indonesia uniform resource locator
positive,miris gp ajar ahok
positive,titit kakak ipar
positive,usaha transpo asi online biadab undang undang no 22 2009dan tolak permen nomor 108th2017 usaha komunis dana komunis cina
positive,bacot cebong ya xf0 x9f x98 x82 xf0 x9f x98 x82 partai komunis indonesia xf0 x9f x98 x82 xf0 x9f x98 x82
positive,allah subhanahu wa taala oceh tiada lindung tolong allah tolong sembah sembah 29 22
positive,tolol tunggu bangsat
positive,picek mata
positive,lemah gerindra orang prabowo turun elektabilitasnya congor fadli zon surat pemberitahuan durno
positive,partai komunis indonesia kali susup acara min massa teriak ganyang partai komunis indonesia
positive,bangsat bangsat tai bego tolol setan alas ndasmu babi anjing monyet bodoh cebong kodok katak mari hilang kosa otak sepakat
positive,mesti proyek asing nasionalis pancasilais pilih asing antek asing nih
positive,wkwk najis gue pilih oke lihat lihat kali
positive,anjing seram sumpah cari tau
positive,timnas cacat mental prestasi km toreh indonesia ketua mundur o orang edan jabat
positive,bubar memebrantas korupsi korupsi rajalela dewan wakil rakyat
positive,tangkap laku polisi lengser jokowi rezim partai komunis indonesia
positive,ayo polisi tangkap usir sih raja kodok komunis istana cebong cina komunis hancur negara republik indonesia
positive,ngentot yuk
positive,kubu prabowo nilai negatif bijak jokowi pilih presiden 2019 uniform resource locator
positive,minggir jalan turun eh maju jorok bego
positive,sih kakak cocot sitohang
positive,pamor rk a inya partai politik usung dukung nista agama
positive,jaka abanjir pimpin akhlak nista agama
positive,cebong dongok dongok abadi xf0 x9f x98 x85 xf0 x9f x98 x85 xf0 x9f x98 x85 xf0 x9f x98 x85 xf0 x9f x98 x85 xf0 x9f x98 x85 xf0 x9f x98 x85 xf0 x9f x98 x85 xf0 x9f x98 x85 x
positive,sampa kolong tol orde a ix gubernur geb anis kerja ya bro presiden ganti soeha o sekolah dasar kerja ya kerja iya enak bacot
positive,lengser jokowi main hukum
positive,kondom me rewatch film marvel televisi ayah tonton yahudi orang islam tonton unsur yahudi me oke sebal
positive,habib sinting anonim dengar sakit jiwa uniform resource locator
positive,komisi berantas korupsi mimpi berantas korupsi orang sangka koruptor
positive,ih najis belepotan
positive,kena bacot
positive,he bajing kloning akun gue bangsat
positive,gila ya bikin webtoon matahari 1 2 lingkar nikah arka sinting gue menang
positive,maklum nama kampret serba hidup gelantung wajar pikir kepala bau pesing kencing basah kepala pesing
positive,najis banget gue mentwit barusan he
positive,kaya susilo bambang yudhoyono hasil korupsi
positive,1 manusia banget sabar banget hadap gue wkwk idiot garis keras suka ambek kg kadang negative thinking kg suka kacang moody kadang ambek e bentar doang ribut bullyable bocah bocah ya
positive,queen coba memek
positive,diam kampang
positive,cocot cangkemu cuk
positive,serah perang cupu
positive,entot dicrotin kontol uh uniform resource locator
positive,ayo sih tua bangkai dukung kampret
positive,res res cebong goblok ya res maklum
positive,oh dasar bajing
positive,panik ganti presiden tau calon ups pimpin koruptor te angkap ganti presiden tau negosiasi
positive,tentara saudi suriah isis banci lari libya uniform resource locator uniform resource locator
positive,perek
positive,ngewe kayak
positive,ya orang orang islam tunduk ketiak rezim anti islam cc
positive,udik darah daging
positive,alex untung tuduh antek cina partai komunis indonesia haha
positive,pikir tuju islam nusantara langsung nama islam kena kena imbas xf0 x9f x98 xa3 xf0 x9f x98 xa3 xf0 x9f x98 xa3 berengsek antek zionis selip organisasi masyarakat
positive,islam nusantara 1 wacana islam arab partai komunis indonesia tumpang partai demokrasi indonesia juang 2015 jokowi menang pilih presiden 2014 sadar sih manfaat sadar
positive,bani kocak nih dukung siwanbango bego
positive,terima kasih informasi mohon mas jean ivan kenan kirim akun banci maksud direct message maklum gadget er gagap terima kasih
positive,cocok cocok penis 4 istri perilaku seks simpang majelis ulama indonesia lgbt nilai perilaku seks simpang
positive,dukung gubernur mulut kotor suka bawa bawa isu sara maki kesana kemari al maidah 51 resmi tambak hubung ikan al maidah 51 ciri orang cerdas 2019 ganti presiden
positive,sarap der
positive,kontras radikal intoleran
positive,maklum kaum onta bodoh indonesia otak dengkul
positive,kenal menge i orang bajing sepe hati asa
positive,ava kemi najis banget tai
positive,bravo buah jatuh pohon pohon buah pohon congor buruk buah
positive,rezim bobrok kiai partai demokrasi indonesia juang demo bahan bakar minyak buku merah eh bahan bakar minyak kesan diam diam plonga plongo presiden presiden pakai bilang kayak umar bin khitan nauzubillah
positive,celeng nya bang acon susah banget xf0 x9f x98 xa
positive,yf ngewe ayo sebal banget gue
positive,bro kitab suci fiksi bera i agama wahyu nyata surat pemberitahuan mutlak harfiah filosofis langgar umat agama konstitusi norma agama nista agama kotor ateis mati
positive,sumpah gue bohong ya gue kerja pabrik feronikel milik rusia kerja orang cina gue jijik jorok bab siram makan babi ular kadal bikin gue jengkel bau badan masya allah taha
positive,lihat lokasi muhammad bantai 800 yahudi 1400 lukman
positive,keren ksatria jantan berani patuh hukum banci kabur sapa polisi xf0 x9f x98 x8e uniform resource locator
positive,lesbi gue anjir
positive,beda muhammad arab buta huruf nabi percaya sempurna tebar biadab bunuh cocok cocok penis
positive,busuk sampah
positive,masjid tua candi candi milik raja hindu buddha nusantara usir cina
positive,allah subhanahu wa taala halal a rampas janji rampas muslim buang islam teriak no korupsi
positive,nih ya gue cowok burung cewek cewek nada nada transgender indonesia nyanyi uniform resource locator
positive,anak setan
positive,prabowo panik prabowo babi buta erang elite politik goblok mental maling kritik konsep kritik arah
positive,ahok lantik gubernur anis anis gubernur
positive,wibisono citra jokowi sebar up media massa pro asing kes jokowi hasil
positive,jalan tuju indonesia islam indah muslim ajak diskusi
positive,orang tolol balas base akun nya kunci
positive,sipit bank rakyat indonesia
positive,emosi gue loey hyung anjir gue pikir keras maksud acara peranjat bego bilang mimpi anjir emosi pangeran xf0 x9f x98 xa9
positive,tuduh partai komunis indonesia jokowi anti islam rakyat percaya kampanye contoh
positive,iklan ahok jahat teroris nyata indonesia wahabi onta babi babi milik cina tebar teror sungguh
positive,jokowi kecut mundur jabat presiden
positive,eror jo kampang kemarin
positive,wkwk sompret anjir nasib buruk tertawa bangsat
positive,cuk bangun bubur tai ayam
positive,pikir agama asli indonesia islam impor kristen impor hindu impor buddha impor yahudi impor komunisme impor impor alir animisme dinamisme pelihara alir jahiliyah x ya
positive,matanajwadebatjaka a anies tinggal tenang tulus debat malam agitatif licik moga kalah anjing
positive,hulk marah 2019 ganti presiden
positive,memek basah nih bang abang masuk tahan ah ah ah
positive,ya allah gusti diam 2019 ganti presiden
positive,setan bikin penasaran haha
positive,aman pegang kacung babu asing mawoooot
positive,salah bangsat kecut indonesia dukung bangsat kecut bani onta grup kabur arab tuhan tidur surat pemberitahuan hadap ahok pal
positive,haduhhh haduhhh ajar gembel
positive,ah buka gagal paham sih kecebong dongok
positive,pacar pacar ya sarap sarap galau
positive,kasih gelar doktor juragan mu prabowo sebianto calon presiden umur hidup
positive,cina usaha kuasa politik hukum indonesia
positive,lawan play station kalah lawan jokowi
positive,buah serang perang twit kubu tel orang kader golkar kenal konsultan politik anies sandi
positive,lepas politik label antek orde kanan fundamentalis
positive,nyinyir dasar grup onta
positive,besok prabowo calon presiden teriak teriak timpang percaya maki wa awan gaji
positive,hebat rusak bangsa uniform resource locator
positive,kristen bunuh afghanistan
positive,suara orok kayak kambing bandot coba pakai gergaji mesin malam malam suara masjid bilang gue budek eh pas kamar nyata haha
positive,xl kunyuk as tai
positive,grafik posisi papa saham bubar komisi berantas korupsi uniform resource locator
positive,dasar manusia homo
positive,jokowi ubah sikap kuasa negara hancur perintah ancam bubar 2019 rakyat lengser jokowi
positive,sepe inya gerombol rindu rusuh hati hati kabul tuhan iklan ahok jahat
positive,kelojot dukung anies sandi
positive,delete post bajing online
positive,belek onta xf0 x9f x98 xa4 bicara gue xf0 x9f x94 xa8 xf0 x9f x98 xa4
positive,ganyang partai komunis indonesia antek antek orang orang ai dukung uniform resource locator
positive,rezim gila aneh konyol kemarin acara rembuk aktivis 98 tonton lawak bikin tertawa acara hadir presiden
positive,kumpul teman nista agama empati korban banjir koar koar puji jujungannya hypertext transfer protocol over secure socket layer t co xqfktdg74x
positive,kaum otak cingkrang suka hoaks maklum jujungannya prof abal abal ulama ajar sekolah kafir k sejarah nu dukung khilafah minoritas ya cari simpatisan nu dasar wa
positive,oh iya ya otak keropos makan belatung onta xf0 x9f x98 x82 xf0 x9f x98 x8
positive,racun nete
positive,partai adil sejahtera sadar rakyat percaya partai adil sejahtera antek korupsi munafik
positive,tau berengsek gue sepe i omong gue ubah
positive,ar sehat calon presiden susilo bambang yudhoyono jelang pikun pikun
positive,kacung terima perintah terima kritik moga pimpin simbol kacung kacung kacung kacung terima kacung tunas subur semerbak harum bunga bangkai
positive,coba perhati sidang teroris alquran an bb dasar apes sontoloyo
positive,goreng goreng gosong suara murni manusia hubung nama jokowi
positive,bangsat ya teman kutuk untung puasa hehe
positive,teman ttman teman titit masuk xf0 x9f x98 xad
positive,ahli sejarah islam pakar islam sila ban informasi bangsa negara
positive,ambil course graphic design gaya pergi class budak fashion nya setan budek nak pakai baju tidur pergi class hanat nya designer appearance noted that maju anjing
positive,bahas bangsa tuhan maha esa pancasila orang indonesia allah subhanahu wa taala benci kafir tuhan
positive,dungu bong bangsa cabik cabik tinggal pungut sampah kayak dasar mata sipit
positive,buka youtube nongol video lucinta luna mulu sih tonton browsing malas kayak sih bencong
positive,edan didinya euy madep t o p
positive,1 bajing
positive,twit gue kampret uniform resource locator
positive,pakai jamin peduli bos jatuh kayak first travel booming laku korban tenggelam orang indonesia budek riak nge i
positive,anies sandi berani
positive,asu wasit picek
positive,alaaa bodoh asing nih xf0 x9f x98 x82 xf0 x9f x98 x82 xf0 x9f x98 x82
positive,suciwati munir percaya jokowi bicara doang uniform resource locator uniform resource locator
positive,bebas adil ustaz alfian tanjung langsung tangkap adil uniform resource locator uniform resource locator
positive,pecun ku uniform resource locator
positive,kunyuk wkwk
positive,masal kena kutuk grup haha kampang nya
positive,anti cina komunis antek asing kapitalis rakus zionis suara enak enak ngentot ya
positive,bikin coldbrew gasal pagi minum melek instan tai gue nge i kopi enak kayak haha
positive,gue benci banget lihat orang koar koar spoiler avenger alah avenger film film protes protes bacot
positive,muuuaaak lihat muka sih tk kepret rr go publik
positive,bajing homo hati hati hadap anak anak utama kamar mandi laki laki biar uniform resource locator
positive,please ya gue dasar gange i af ya gue idiot kayak ya kayak kayak kayak uniform resource locator
positive,ahok tumbang fakta bilang fitnah debat final pilih kepala daerah jakarta
positive,bencong hasil selingkuh maknya perek gerwani kuda prabowo lahir sih onta bencong akun abal abal ngeooaahahahaaaaa xf0 x9f xa4 xa3 xf0 x9f xa4 xa3 xf0 x9f x92 xa6 xf
positive,baca berita nya nih aki ganggu jiwa nya 2019 amin kalah malaikat bilang kafir pro asing kasihan malaikat nge i urus calon presiden bawa aki gila
positive,hutang nya bangga in bukti rezim gagal 2019 ganti presiden
positive,tenang alah kontol
positive,3 kelompok rezim rekayasa terorisme islam rusak citra islam indonesia 4 tuduh umat islam indonesia militan radikal garis keras 5 sudut islam isu sepe i lgbt 6 tuduh curiga i
positive,foto swafoto foto badan utama foto baju buka beware orang sinting jaga
positive,takut tinggal last last tinggal babi
positive,coba cek struktur tim kampanye anies sandi asma dewi wakil bendahara aksi 212
positive,dasar bencong
positive,legislatif gagal ambil calon wakil bego
positive,2 ulang kali lapor masyarakat kait benci amp fitnah a noda agama amp ulama proses polisi super lambat sigap polisi tangkap aktivis 212 surat pemberitahuan ustaz alfian amp bang jonru ginting
positive,goblok mata picek
positive,jijik bodoh
positive,negara tunduk front bela islam lengser jabat libat
positive,1 kivlan zen oceh siang transfer uang prabowo dramatis indonesia lawyers club isu partai komunis indonesia masyarakat cuat indonesia lawyers club partai komunis indonesia
positive,bego ya kampret potensi rugi cebok mata cing onta
positive,kenal be ahun2 pon still x berani natural killer i love suka hem kenal 2 pon kat wechat ajak angkat wow budaya kotor zaman nih jijik bodoh
positive,apik jelek urus nek suka ya diam rasah nyangkem maaf nek masak picek masak budek orang xe2 x80 xa6
positive,selamat jokowi hasil hutang bayar rakyat good luck
positive,laku rezim jokowi baca rezim susilo bambang yudhoyono jilid 3 raih dukung republiken isu islam radikal terorisme islam ancam isis islam nusantara lgbt goreng republiken as presiden ri tang
positive,ngawur sembarang panitia khusus hambat komisi berantas korupsi lidi teman teman koruptor bubar dewan wakil rakyat sarang koruptor
positive,bangkai hajar
positive,negeri selamat 1 syarat lengser jokowi jaga negara republik indonesia selamat negeri
positive,ahok korban gubernur senyum penuh menang bau busuk anyir simbah nanah luka sara cenderung cuci tangan
positive,ai sompret bubar pilih
positive,biar biar tai nya kena ya suka ahok biar kena tai nya
positive,ninja kali nih tukang roti keliling cepat banget hilang kali gue rumah kejar sarap
positive,ustad ngentot ngentot pas dakwah ya kasih kutip dakwah xf0 x9f x98 x82
positive,ya laden sila obrol kampret maaf lo ya cebong orang orang sibuk luang interaksi kampret kampret anggur surat pemberitahuan
positive,mas manusia homo suka pentil mimi peri
positive,sampean cari cari salah lemah komisi berantas korupsi ujung ujung komisi berantas korupsi bubar
positive,viral kocok kontol om security emut unduh streaming video kualitas high definition biar puas link hypertext transfer protocol xe2 x80 xa6
positive,lupa dukung nista agama ahok uniform resource locator
positive,pakai paksa paksa jokowi duduk rakhine prabowo anggur politikus anggur omong ngawur
positive,bentuk titit bocah tk
positive,bicara gue orang berengsek be emen orang orang biar citra bawa
positive,ai plus teman teman bikin malu indonesia min mbok ya goblok banget to min
positive,prabowo musuh partai komunis indonesia antek antek uniform resource locator
positive,dokumen hasil tim cari fakta munir hilang hilang nyali politik jokowi era mega
positive,bacot doang gue berani laku
positive,cc woyyyyyyyyyyyy bangsat anjing badak monyet congor koar koar jokowi presiden utang oi monyet bangsat tunggak bayar listrik bangsat
positive,perempuan kayak mending mati deh jelek sok make up a ist
positive,bicara geblek
positive,ehhhhh bandot kritik jokowi mencret darah is oke hina fitnah ambil tindak jokowi presiden pimpin negara pimpin agama salah kaprah luuuu
positive,prabowo cemeeh usaha perintah rohingya dunia internasional puji lihat prabowo citra
positive,teman indonesia network election survey malam bang indonesia network election survey sange berat hubung indonesia network election survey ya 62823 9111 5459 jamin puas bispak janda meme xe2 x80 xa6
positive,kunyuk kunyuk heboh prof tumpang gelap pasu nasi campur
positive,kayak tai era mas jokowi xf0 x9f x98 xa1
positive,tukar cincin makan sipit mata belok mata ron sipit
positive,babi nih haihhh
positive,cebong cd kon xf0 x9f x98 x82 xf0 x9f x98 x82 xf0 x9f x98 x82
positive,jaman daerah khusus ibukota main isu cina kafir cina kafir keluarga sih ono silit eh sulit
positive,sair luka hati rruarrr by the way bangkai tikus bikin gue jijik bangkai setan
positive,ustad mondok sih kerja mentwit bikin status nyinyir twitter kafir stad
positive,wkwkkk bani kacung gemar jamban dungu optimal cung
positive,tangkap setya novanto sanggup bubar komisi berantas korupsi
positive,uniform resource locator kerja usul bubar dewan wakil rakyat kerja wakil rakyat korup lindung koruptor
positive,panas edan
positive,neng hormat pakai mulut bicara mohon maaf pakai silit
positive,kritis tangkap negara sinting
positive,iya serang pandang beda bubar komisi berantas korupsi benah komisi berantas korupsi selamat ketua
positive,anjir seram main xf0 x9f x98 x82 xf0 x9f x91 x8c
positive,diam lu bangkai
positive,satria udik
positive,polisi selidik asma kait sih anies sandi kait ramai nih gubernur hasil sebar benci uniform resource locator
positive,ai bangkit paham komunis bangkit tanam rezim
positive,logika arab saudi investasi cina 800 t cina investasi indonesia protes tolol nama xf0 x9f x98 xa3
positive,cocok langit bumi kampret cebong adem cebong
positive,rusak jadwal teknisi rumah pagi sore tunggu kacrut
positive,autis gara gara gigi gingsul pwj xf0 x9f x98 x82 xf0 x9f x98 x82 xf0 x9f x98 x82 xf0 x9f x98 x82
positive,partai komunis indonesia partai demokrasi indonesia p bubar partai demokrasi indonesia p
positive,setan kutuk sedih banget gue
positive,jokowi diktator
positive,napi ya napi beda ya tolol sok bela nista agama status napi bong hehe
positive,goblok permanen xf0 x9f x98 xad
positive,oh iya gays malam admin ml video crot nya tebak kontol admin ngentot lokal gay gay cirebon pej xe2 x80 xa6
positive,klop prabowo berontak koruptor
positive,prabowo berantas tindas muslim lihat banget adil pimpin bilang berantas tindas agama
positive,hamdalah selesai fitur keparat
positive,cocok prabowo myanmar kuda
positive,muak fitnah prabowo
positive,maju babi
positive,indonesia terjemah cina
positive,isi surat kayak titip nisa sangkut suka suka jaga edan sakit banget xf0 x9f x98 xa2 xf0 x9f x98 xa2 xf0 x9f x98 xa2 xf0 x9f x98 xa2 xf0 x9f x98 xa2
positive,edan foto shoot
positive,tuju bubar komisi berantas korupsi angkat ketua badan berantas korupsi uniform resource locator
positive,bodoh anjir bodoh tertawa gue tertawa astagfirullah humor banget uniform resource locator
positive,badan gue bicara xe2 x80 x9choi dengar tulang gue bunyi mata gue lelah lihat layar melulu tangan cape etik melulu he budek xe2 x80 x9d xe2 x80 x9cgue dengar bego maaf gue xe2 x80 x9d xf0 x9f x98 xad xf0 x9f
positive,tau jaman megawati korupsi nya jaman susilo bambang yudhoyono uniform resource locator
positive,keren nih program terima kasih jokowi jokowi istirahat ya
positive,he sinting ya uniform resource locator
positive,awaasss berita saudara gerung susah cari kosakata bocor picing mata bibir monyong samping suara ky nhn kentut politik kotor zaman b pulang ky nhn ngeden dungu xf0 x9f x98 x8b
positive,maju anjing uniform resource locator
positive,tolol coba orang malu
positive,suka nete uji nasional maklum
positive,jokowi kenal kawasan kolam kodok uniform resource locator
positive,gue bilang anjir bagus
positive,susah harap ai dukung perintah bukti dukung setia ahok sih nista agama musuh umat islam
positive,cebong dolar pengaruh mata picek ganti presiden 2019
positive,wanda medical check up nerf habis kesal gue ya kena nerf sih wanda culun banget tingkat harry potret
positive,haha te ipu onta arab
positive,culun nih serigala margonda payah
positive,gigih juang 2 periode cerita rawan ya proyek masuk nama ya fee dipungkiri andai rezim runtuh jilat jilat miskin bui 2019 ganti presiden
positive,cebong otak asa korban tau nyinyir
positive,tolong sih onta nyanyi mulu semprot baygon
positive,najis jam gin tidur masak nasi hmmmmz
positive,iya akun hutang negara pimpin kalah gunung sahari
positive,41 bijak pilih opsi mundur ambisi kuasa jokowi pilih opsi be ahan
positive,teman makan teman uji pas pura pura budek panggil reuni
positive,turun jokowi deh
positive,bodoh mak bahagia
positive,najis not wkwk
positive,bunuh partai komunis indonesia anak balas dendam usir komunis cina reklamasi
positive,caci ulama nya orang kafir munafik pakai otak mu bodoh
positive,mampus kalah lawan gue
positive,mayoritas etnis cina daerah khusus ibukota solid dukung nista agama islam dendam nasionalis
positive,orang orang budek tuli pekak tolol
positive,aksi turun jokowi biar selamat indonesia malu calon presiden
positive,dasar kunyuk nih cari duit modal tipu bangsat abu
positive,selamat tim dulunya jaya sisa main main burik xf0 x9f x98 x82
positive,kafir lae menteri mahathir bayang kafir asing asing menteri kena demo jilid jilid ya
positive,ava jelek mentwit sa ramai ya set kontol kepala mata
positive,najis banget erel bencong
positive,dukung ahok rela beliau gubernur khianat laku warga jakarta uniform resource locator
positive,iya kampung alay tonton bola singapura johor malaysia uniform resource locator
positive,mutakhir haha muncul lahir islam agama kafir bilang bangkang
positive,banci uniform resource locator
positive,dasar kafir laknatullah
positive,kontol sih abang selamat pagi uniform resource locator
positive,mbak mua doang juta edan
positive,rezim kaum anut tolol
positive,jokowi perintah tau panglima tentara nasional indonesia jabat presiden perintah presiden bodoh be epi
positive,beresss lo nafsu presiden prestasi lo kelici lo biar rakyat nilai rakyat pintar
positive,98 gue ogah teman rl rupiah anjing gue canda menang wkwk tau orang bikin gue bacot sih wkwk
positive,anjing tertawa
positive,anjing goblok setan bangsat
positive,anjing najis banget mino jelek
positive,goblok selesai selesai nakal goblok uniform resource locator
positive,calon legislatif budek amp ngawur bayang xf0 x9f xa4 x94 xf0 x9f x98 x84
positive,masuk zat biar rps nrp sinting rekayasa perangkat lunak nrp lambe uniform resource locator
positive,ai koalisi dukung perintah jalin kerja politik ai komunis cina
positive,gembel indomaret gue belanja atm mas
positive,putar goblok bikin emosi ya
positive,jaman mas jajah merdeka kerja asing korea utara main twitter pakai produk asing tanggung anti asing
positive,sih dakwa nista agama alias sih ahok babi jamban morfin uang rakyat jaka a
positive,iya bencong idiot surat pemberitahuan pakai foto asli
positive,akibat makan gaji duit korupsi bantu likuiditas bank indonesia laku tokek tokek cina otak cebong dungu tenaga kerja asing cina fiksi fakta anggap isu fiktif hancur negara jual
positive,direktur jenderal agama agama banding posisi tuhan ajar agama
positive,setan muncul heran
positive,15 tuduh komisi berantas korupsi bukti lhi paksa putus salah coba suap vonis 16 penjara n16 penjara nama a hormat keluarga hancur fitnah komisi berantas korupsi media media bajing kolaborator komisi berantas korupsi kapok mafia bejat
positive,ngewe wkwk ngewe ngewe
positive,jokowi citra pilih presiden perkara harga saham mahal poin poin prinsip pakat urus pilih presiden metode kerja rezim jokowi sepe i
positive,6 paksa banget presiden mas maling uang rakyat amp gaya politik pakai ayat mayat agama ambisi orang sepe i otak normal ya mardani kelimpungan
positive,ngewe
positive,orang gek motivasi dikon atraksi gendeng hina kafir cebong tai lancung seko mentok sing gek rami ah jolodong
positive,anak keparat bangsat butuh bina bina mohon binasa
positive,muhammad burak makkah yerusalem dongeng ibrahim makkah
positive,menteri negeri indonesia janji hancur kuat anti cina jokowi anti pribumi turun jokowi tiru turki
positive,kali jakarta kumuh anies sandi
positive,ya goblok untung cebong happy dungu versi gerung gerung xf0 x9f x98 x82 xf0 x9f x98 x82 xf0 x9f x98 x82 xf0 x9f x98 x82
positive,geblek polisi tau wkwk
positive,mulut allah subhanahu wa taala alquran busuk kafir laknat
positive,lapor islam hina majelis ulama indonesia front bela islam ban
